School Name,Department Name,URL
University of Leeds,"Chemical Engineering (Industrial) MEng, BEng",https://courses.leeds.ac.uk/g702/chemical-engineering-industrial-meng-beng
University of Leeds,Chemical Engineering BEng,https://courses.leeds.ac.uk/4810/chemical-engineering-beng
University of Leeds,"Chemical Engineering MEng, BEng",https://courses.leeds.ac.uk/f463/chemical-engineering-meng-beng
University of Leeds,Chemical Engineering,https://courses.leeds.ac.uk/f463/chemical-engineering-meng-beng
University of Leeds,Chemistry and Mathematics BSc,https://courses.leeds.ac.uk/4187/chemistry-and-mathematics-bsc
University of Leeds,Chemistry and Mathematics,https://courses.leeds.ac.uk/4187/chemistry-and-mathematics-bsc
University of Leeds,"Chemistry and Mathematics MChem, BSc",https://courses.leeds.ac.uk/i040/chemistry-and-mathematics-mchem-bsc
University of Leeds,Chemistry and Mathematics,https://courses.leeds.ac.uk/i040/chemistry-and-mathematics-mchem-bsc
University of Leeds,Chemistry BSc,https://courses.leeds.ac.uk/3220/chemistry-bsc
University of Leeds,Chemistry,https://courses.leeds.ac.uk/3220/chemistry-bsc
University of Leeds,"Chemistry MChem, BSc",https://courses.leeds.ac.uk/f422/chemistry-mchem-bsc
University of Leeds,Chemistry,https://courses.leeds.ac.uk/f422/chemistry-mchem-bsc
University of Leeds,Chemistry MSc,https://courses.leeds.ac.uk/i588/chemistry-msc
University of Leeds,Chemistry,https://courses.leeds.ac.uk/i588/chemistry-msc
University of Leeds,"Chemistry with a Year in Industry MChem, BSc",https://courses.leeds.ac.uk/f423/chemistry-with-a-year-in-industry-mchem-bsc
University of Leeds,Chemistry with a Year in Industry,https://courses.leeds.ac.uk/f423/chemistry-with-a-year-in-industry-mchem-bsc
University of Leeds,"Chemistry with Study Abroad MChem, BSc",https://courses.leeds.ac.uk/i114/chemistry-with-study-abroad-mchem-bsc
University of Leeds,Chemistry with Study Abroad,https://courses.leeds.ac.uk/f425/chemistry-with-study-abroad-mchem-bsc
University of Leeds,Child and Family Studies BA,https://courses.leeds.ac.uk/j554/child-and-family-studies-ba
University of Leeds,Child and Family Studies,https://courses.leeds.ac.uk/j554/child-and-family-studies-ba
University of Leeds,Childhood Studies BA,https://courses.leeds.ac.uk/115/childhood-studies-ba
University of Leeds,Childhood Studies,https://courses.leeds.ac.uk/115/childhood-studies-ba
University of Leeds,Childhood Studies MA,https://courses.leeds.ac.uk/g573/childhood-studies-ma
University of Leeds,Childhood Studies,https://courses.leeds.ac.uk/g573/childhood-studies-ma
University of Leeds,Chinese (Modern) BA,https://courses.leeds.ac.uk/e315/chinese-modern-ba
University of Leeds,Chinese (Modern),https://courses.leeds.ac.uk/e315/chinese-modern-ba
University of Leeds,Chinese and Italian B,https://courses.leeds.ac.uk/0808/chinese-and-italian-b-ba
University of Leeds,Chinese and Japanese Studies BA,https://courses.leeds.ac.uk/0080/chinese-and-japanese-studies-ba
University of Leeds,Chinese and Japanese Studies,https://courses.leeds.ac.uk/0080/chinese-and-japanese-studies-ba
University of Leeds,Chinese and Portuguese,https://courses.leeds.ac.uk/830/chinese-and-portuguese-ba
University of Leeds,Chinese and Russian A,https://courses.leeds.ac.uk/e604/chinese-and-russian-a-ba
University of Leeds,Chinese and Russian B,https://courses.leeds.ac.uk/850/chinese-and-russian-b-ba
University of Leeds,Chinese and Russian BA,https://courses.leeds.ac.uk/j944/chinese-and-russian-ba
University of Leeds,Chinese and Thai Studies BA,https://courses.leeds.ac.uk/g308/chinese-and-thai-studies-ba
University of Leeds,Chinese and Thai Studies,https://courses.leeds.ac.uk/g308/chinese-and-thai-studies-ba
University of Leeds,Civil and Environmental Engineering (Industrial) BEng,https://courses.leeds.ac.uk/i064/civil-and-environmental-engineering-industrial-beng
University of Leeds,"Civil and Environmental Engineering (Industrial) MEng, BEng",https://courses.leeds.ac.uk/g839/civil-and-environmental-engineering-industrial-meng-beng
University of Leeds,Civil and Environmental Engineering BEng,https://courses.leeds.ac.uk/4836/civil-and-environmental-engineering-beng
University of Leeds,"Civil and Environmental Engineering MEng, BEng",https://courses.leeds.ac.uk/f443/civil-and-environmental-engineering-meng-beng
University of Leeds,Civil and Environmental Engineering,https://courses.leeds.ac.uk/f443/civil-and-environmental-engineering-meng-beng
University of Leeds,Civil and Structural Engineering (Industrial) BEng,https://courses.leeds.ac.uk/i323/civil-and-structural-engineering-industrial-beng
University of Leeds,"Civil and Structural Engineering (Industrial) MEng, BEng",https://courses.leeds.ac.uk/g653/civil-and-structural-engineering-industrial-meng-beng
University of Leeds,Civil and Structural Engineering BEng,https://courses.leeds.ac.uk/a252/civil-and-structural-engineering-beng
University of Leeds,"Civil and Structural Engineering MEng, BEng",https://courses.leeds.ac.uk/f412/civil-and-structural-engineering-meng-beng
University of Leeds,Civil and Structural Engineering,https://courses.leeds.ac.uk/f412/civil-and-structural-engineering-meng-beng
University of Leeds,Civil Engineering (Industrial) BEng,https://courses.leeds.ac.uk/j155/civil-engineering-industrial-beng
University of Leeds,"Civil Engineering (Industrial) MEng, BEng",https://courses.leeds.ac.uk/j621/civil-engineering-industrial-meng-beng
University of Leeds,Civil Engineering BEng,https://courses.leeds.ac.uk/i444/civil-engineering-beng
University of Leeds,"Civil Engineering MEng, BEng",https://courses.leeds.ac.uk/i445/civil-engineering-meng-beng
University of Leeds,Civil Engineering,https://courses.leeds.ac.uk/i445/civil-engineering-meng-beng
University of Leeds,Civil Engineering with Transport BEng,https://courses.leeds.ac.uk/i058/civil-engineering-with-transport-beng
University of Leeds,Civil Engineering with Transport,https://courses.leeds.ac.uk/i058/civil-engineering-with-transport-beng
University of Leeds,Classical Civilisation and English,https://courses.leeds.ac.uk/g514/classical-civilisation-and-english-ba
University of Leeds,Classical Civilisation and History,https://courses.leeds.ac.uk/g581/classical-civilisation-and-history-ba
University of Leeds,Classical Civilisation and Philosophy,https://courses.leeds.ac.uk/g517/classical-civilisation-and-philosophy-ba
University of Leeds,Classical Civilisation BA,https://courses.leeds.ac.uk/0090/classical-civilisation-ba
University of Leeds,Classical Civilisation,https://courses.leeds.ac.uk/0090/classical-civilisation-ba
University of Leeds,Classical Literature and English BA,https://courses.leeds.ac.uk/856/classical-literature-and-english-ba
University of Leeds,Classical Literature and English,https://courses.leeds.ac.uk/856/classical-literature-and-english-ba
University of Leeds,Classical Literature and Philosophy BA,https://courses.leeds.ac.uk/a565/classical-literature-and-philosophy-ba
University of Leeds,Classical Literature and Philosophy,https://courses.leeds.ac.uk/a565/classical-literature-and-philosophy-ba
University of Leeds,Climate and Atmospheric Science MRes,https://courses.leeds.ac.uk/g223/climate-and-atmospheric-science-mres
University of Leeds,Climate and Atmospheric Science,https://courses.leeds.ac.uk/g223/climate-and-atmospheric-science-mres
University of Leeds,"Climate Futures: Science, Society and Politics MSc",https://courses.leeds.ac.uk/j654/climate-futures-science-society-and-politics-msc
University of Leeds,"Climate Futures: Science, Society and Politics",https://courses.leeds.ac.uk/j654/climate-futures-science-society-and-politics-msc
University of Leeds,Clinical Anatomy,https://courses.leeds.ac.uk/g615/clinical-anatomy-bsc
University of Leeds,Clinical Assessment,https://courses.leeds.ac.uk/h377/clinical-assessment-pgcert
University of Leeds,Clinical Assessment PGCert,https://courses.leeds.ac.uk/h377/clinical-assessment-pgcert
University of Leeds,Clinical Education BSc,https://courses.leeds.ac.uk/j994/clinical-education-bsc
University of Leeds,Clinical Education MEd,https://courses.leeds.ac.uk/c020/clinical-education-med
University of Leeds,Clinical Education,https://courses.leeds.ac.uk/c020/clinical-education-med
University of Leeds,Clinical Education PGCert,https://courses.leeds.ac.uk/c023/clinical-education-pgcert
University of Leeds,Clinical Education PGCert,https://courses.leeds.ac.uk/d098/clinical-education-pgcert
University of Leeds,Clinical Education,https://courses.leeds.ac.uk/c023/clinical-education-pgcert
University of Leeds,Clinical Education PGDip,https://courses.leeds.ac.uk/f635/clinical-education-pgdip
University of Leeds,Clinical Education,https://courses.leeds.ac.uk/f635/clinical-education-pgdip
University of Leeds,Clinical Embryology and Assisted Reproduction Technology MSc,https://courses.leeds.ac.uk/g634/clinical-embryology-and-assisted-reproduction-technology-msc
University of Leeds,Clinical Embryology and Assisted Reproduction Technology,https://courses.leeds.ac.uk/g634/clinical-embryology-and-assisted-reproduction-technology-msc
University of Leeds,Clinical Embryology and Assisted Reproduction Technology PGDip,https://courses.leeds.ac.uk/g635/clinical-embryology-and-assisted-reproduction-technology-pgdip
University of Leeds,Clinical Embryology and Assisted Reproduction Technology,https://courses.leeds.ac.uk/g635/clinical-embryology-and-assisted-reproduction-technology-pgdip
University of Leeds,Clinical Embryology MSc,https://courses.leeds.ac.uk/d027/clinical-embryology-msc
University of Leeds,Clinical Embryology,https://courses.leeds.ac.uk/d027/clinical-embryology-msc
University of Leeds,Clinical Embryology PGDip,https://courses.leeds.ac.uk/d321/clinical-embryology-pgdip
University of Leeds,Clinical Embryology,https://courses.leeds.ac.uk/d321/clinical-embryology-pgdip
University of Leeds,Cognitive Development and Disorders MSc,https://courses.leeds.ac.uk/i086/cognitive-development-and-disorders-msc
University of Leeds,Cognitive Development and Disorders,https://courses.leeds.ac.uk/i086/cognitive-development-and-disorders-msc
University of Leeds,Communication and Media BA,https://courses.leeds.ac.uk/g199/communication-and-media-ba
University of Leeds,Communication and Media,https://courses.leeds.ac.uk/g199/communication-and-media-ba
University of Leeds,Communication and Media MA,https://courses.leeds.ac.uk/g636/communication-and-media-ma
University of Leeds,Communication and Media,https://courses.leeds.ac.uk/g636/communication-and-media-ma
University of Leeds,Communications and Signal Processing MSc (Eng),https://courses.leeds.ac.uk/g235/communications-and-signal-processing-msc-eng-
University of Leeds,Communications and Signal Processing,https://courses.leeds.ac.uk/g235/communications-and-signal-processing-msc-eng-
University of Leeds,"Computer Science (Artificial Intelligence) (Industrial) MEng, BSc",https://courses.leeds.ac.uk/i607/computer-science-with-artificial-intelligence-industrial-meng-bsc
University of Leeds,"Computer Science (Artificial Intelligence) MEng, BSc",https://courses.leeds.ac.uk/j750/computer-science-artificial-intelligence-meng-bsc
University of Leeds,Computer Science (Digital & Technology Solutions),https://courses.leeds.ac.uk/ap01/computer-science-digital-technology-solutions-bsc
University of Leeds,"Computer Science (High-Performance Graphics and Games Engineering) (Industrial) MEng, BSc",https://courses.leeds.ac.uk/i698/computer-science-high-performance-graphics-and-games-engineering-industrial-meng-bsc
University of Leeds,"Computer Science (High-Performance Graphics and Games Engineering) MEng, BSc",https://courses.leeds.ac.uk/j751/computer-science-high-performance-graphics-and-games-engineering-meng-bsc
University of Leeds,Computer Science (Industrial) BSc,https://courses.leeds.ac.uk/3262/computer-science-industrial-bsc
University of Leeds,"Computer Science (Industrial) MEng, BSc",https://courses.leeds.ac.uk/g098/computer-science-industrial-meng-bsc
University of Leeds,Computer Science and Mathematics,https://courses.leeds.ac.uk/i076/computer-science-and-mathematics-msci-bsc
University of Leeds,Computer Science BSc,https://courses.leeds.ac.uk/3260/computer-science-bsc
University of Leeds,"Computer Science MEng, BSc",https://courses.leeds.ac.uk/f919/computer-science-meng-bsc
University of Leeds,Computer Science,https://courses.leeds.ac.uk/f919/computer-science-meng-bsc
University of Leeds,Computer Science with Artificial Intelligence,https://courses.leeds.ac.uk/g734/computer-science-with-artificial-intelligence-meng-bsc
University of Leeds,Computer Science with High-Performance Graphics and Games Engineering,https://courses.leeds.ac.uk/i069/computer-science-with-high-performance-graphics-and-games-engineering-meng-bsc
University of Leeds,Conference Interpreting and Translation Studies MA,https://courses.leeds.ac.uk/i411/conference-interpreting-and-translation-studies-ma
University of Leeds,Conference Interpreting and Translation Studies,https://courses.leeds.ac.uk/i411/conference-interpreting-and-translation-studies-ma
University of Leeds,Conference Interpreting PGDip,https://courses.leeds.ac.uk/i412/conference-interpreting-pgdip
University of Leeds,Conference Interpreting,https://courses.leeds.ac.uk/i412/conference-interpreting-pgdip
University of Leeds,"Conflict, Development and Peacebuilding MA",https://courses.leeds.ac.uk/j683/conflict-development-and-peacebuilding-ma
University of Leeds,"Conflict, Development and Peacebuilding",https://courses.leeds.ac.uk/j683/conflict-development-and-peacebuilding-ma
University of Leeds,Consumer Analytics and Marketing Strategy MSc,https://courses.leeds.ac.uk/g963/consumer-analytics-and-marketing-strategy-msc
University of Leeds,Consumer Analytics and Marketing Strategy,https://courses.leeds.ac.uk/g963/consumer-analytics-and-marketing-strategy-msc
University of Leeds,"Corporate Communications, Marketing and Public Relations",https://courses.leeds.ac.uk/g921/corporate-communications-marketing-and-public-relations-ma
University of Leeds,"Corporate Communications, Marketing and Public Relations MA",https://courses.leeds.ac.uk/g921/corporate-communications-marketing-and-public-relations-ma
University of Leeds,Course Search,https://courses.leeds.ac.uk/
University of Leeds,Course Search,https://courses.leeds.ac.uk/course-search/undergraduate-courses
University of Leeds,Course Search,https://courses.leeds.ac.uk/course-search/masters-courses
University of Leeds,Course Terms,https://courses.leeds.ac.uk/courseterms
University of Leeds,Creative Writing MA,https://courses.leeds.ac.uk/j704/creative-writing-ma
University of Leeds,Creative Writing,https://courses.leeds.ac.uk/j704/creative-writing-ma
University of Leeds,Criminal Justice and Criminal Law LLM,https://courses.leeds.ac.uk/g665/criminal-justice-and-criminal-law-llm
University of Leeds,Criminal Justice and Criminal Law,https://courses.leeds.ac.uk/g665/criminal-justice-and-criminal-law-llm
University of Leeds,Criminal Justice and Criminology BA,https://courses.leeds.ac.uk/e989/criminal-justice-and-criminology-ba
University of Leeds,Criminal Justice and Criminology,https://courses.leeds.ac.uk/e989/criminal-justice-and-criminology-ba
University of Leeds,Criminal Justice and Criminology MSc,https://courses.leeds.ac.uk/i129/criminal-justice-and-criminology-msc
University of Leeds,Criminal Justice and Criminology,https://courses.leeds.ac.uk/i129/criminal-justice-and-criminology-msc
University of Leeds,Critical and Applied Musicology,https://courses.leeds.ac.uk/g526/critical-and-applied-musicology-ma
University of Leeds,Critical and Cultural Theory MA,https://courses.leeds.ac.uk/g528/critical-and-cultural-theory-ma
University of Leeds,Critical and Cultural Theory,https://courses.leeds.ac.uk/g528/critical-and-cultural-theory-ma
University of Leeds,Critical and Experimental Composition MMus,https://courses.leeds.ac.uk/g523/critical-and-experimental-composition-mmus
University of Leeds,Critical and Experimental Composition,https://courses.leeds.ac.uk/g523/critical-and-experimental-composition-mmus
University of Leeds,Cultural and Media Studies BA,https://courses.leeds.ac.uk/g641/cultural-and-media-studies-ba
University of Leeds,Cultural and Media Studies,https://courses.leeds.ac.uk/g641/cultural-and-media-studies-ba
University of Leeds,"Culture, Creativity and Entrepreneurship MA","https://courses.leeds.ac.uk/f018/culture,-creativity-and-entrepreneurship-ma"
University of Leeds,"Culture, Creativity and Entrepreneurship",https://courses.leeds.ac.uk/f018/culture-creativity-and-entrepreneurship-ma
University of Leeds,Data Analytics and Human Resource Management,https://courses.leeds.ac.uk/i693/data-analytics-and-human-resource-management-msc
University of Leeds,Data Analytics and Human Resource Management MSc,https://courses.leeds.ac.uk/i693/data-analytics-and-human-resource-management-msc
University of Leeds,Data Science (Statistics) MSc,https://courses.leeds.ac.uk/d053/data-science-statistics-msc
University of Leeds,Data Science and Analytics for Health MRes,https://courses.leeds.ac.uk/i927/data-science-and-analytics-for-health-mres
University of Leeds,Data Science and Analytics for Health,https://courses.leeds.ac.uk/i927/data-science-and-analytics-for-health-mres
University of Leeds,Data Science and Analytics MSc,https://courses.leeds.ac.uk/i071/data-science-and-analytics-msc
University of Leeds,Data Science and Analytics,https://courses.leeds.ac.uk/i071/data-science-and-analytics-msc
University of Leeds,Data Science BSc,https://courses.leeds.ac.uk/j747/data-science-bsc
University of Leeds,Deaf Education (Teacher of the Deaf Qualification),https://courses.leeds.ac.uk/d308/deaf-education-teacher-of-the-deaf-qualification-ma
University of Leeds,Deaf Education (Teacher of the Deaf Qualification) MA,https://courses.leeds.ac.uk/d329/deaf-education-teacher-of-the-deaf-qualification-ma
University of Leeds,Deaf Education (Teacher of the Deaf Qualification) PGDip,https://courses.leeds.ac.uk/d330/deaf-education-teacher-of-the-deaf-qualification-pgdip
University of Leeds,Deaf Education,https://courses.leeds.ac.uk/d990/deaf-education-pgdip
University of Leeds,Dental Hygiene and Dental Therapy BSc,https://courses.leeds.ac.uk/i125/dental-hygiene-and-dental-therapy-bsc
University of Leeds,Dental Hygiene and Dental Therapy,https://courses.leeds.ac.uk/i125/dental-hygiene-and-dental-therapy-bsc
University of Leeds,Dental Materials MSc,https://courses.leeds.ac.uk/i585/dental-materials-msc
University of Leeds,Dental Materials,https://courses.leeds.ac.uk/i585/dental-materials-msc
University of Leeds,Dental Public Health MSc,https://courses.leeds.ac.uk/g579/dental-public-health-msc
University of Leeds,Dental Public Health,https://courses.leeds.ac.uk/g579/dental-public-health-msc
University of Leeds,Dental Surgery BChD,https://courses.leeds.ac.uk/j926/dental-surgery-bchd
University of Leeds,"Dental Surgery MChD/BChD, Oral Science BSc",https://courses.leeds.ac.uk/g033/dental-surgery-mchd-bchd-oral-science-bsc-mchd-bchd-bsc
University of Leeds,Design MA,https://courses.leeds.ac.uk/a672/design-ma
University of Leeds,Design,https://courses.leeds.ac.uk/a672/design-ma
University of Leeds,Diagnostic Imaging (Diagnostic Radiography),https://courses.leeds.ac.uk/j429/diagnostic-imaging-diagnostic-radiography-msc
University of Leeds,Diagnostic Imaging (Diagnostic Radiography),https://courses.leeds.ac.uk/j439/diagnostic-imaging-diagnostic-radiography-pgcert
University of Leeds,Diagnostic Imaging (Diagnostic Radiography),https://courses.leeds.ac.uk/j430/diagnostic-imaging-diagnostic-radiography-pgdip
University of Leeds,Diagnostic Imaging (Medical Ultrasound),https://courses.leeds.ac.uk/j422/diagnostic-imaging-medical-ultrasound-msc
University of Leeds,Diagnostic Imaging (Medical Ultrasound),https://courses.leeds.ac.uk/j425/diagnostic-imaging-medical-ultrasound-pgcert
University of Leeds,Diagnostic Imaging (Medical Ultrasound),https://courses.leeds.ac.uk/j423/diagnostic-imaging-medical-ultrasound-pgdip
University of Leeds,Diagnostic Imaging (Medical Ultrasound),https://courses.leeds.ac.uk/j424/diagnostic-imaging-medical-ultrasound-pgdip
University of Leeds,Diagnostic Radiography BSc,https://courses.leeds.ac.uk/i102/diagnostic-radiography-bsc
University of Leeds,Diagnostic Radiography,https://courses.leeds.ac.uk/i102/diagnostic-radiography-bsc
University of Leeds,Digital and Automated Chemistry MSc,https://courses.leeds.ac.uk/j927/digital-and-automated-chemistry-msc
University of Leeds,Digital Design and Communication,https://courses.leeds.ac.uk/d014/digital-design-and-communication-ma
University of Leeds,Digital Design and Communication,https://courses.leeds.ac.uk/d015/digital-design-and-communication-pgcert
University of Leeds,Digital Design Futures MA,https://courses.leeds.ac.uk/j440/digital-design-futures-ma
University of Leeds,Digital Design Futures,https://courses.leeds.ac.uk/j440/digital-design-futures-ma
University of Leeds,Digital Education MA,https://courses.leeds.ac.uk/d981/digital-education-ma
University of Leeds,Digital Education,https://courses.leeds.ac.uk/d981/digital-education-ma
University of Leeds,Digital Education PT PGCert,https://courses.leeds.ac.uk/d992/digital-education-pt-pgcert
University of Leeds,Digital Education PT,https://courses.leeds.ac.uk/d992/digital-education-pt-pgcert
University of Leeds,Digital Education PT,https://courses.leeds.ac.uk/d991/digital-education-pt-pgdip
University of Leeds,Digital Information Management and Systems Innovation,https://courses.leeds.ac.uk/g506/digital-information-management-and-systems-innovation-msc
University of Leeds,Digital Media BA,https://courses.leeds.ac.uk/g856/digital-media-ba
University of Leeds,Digital Media,https://courses.leeds.ac.uk/g856/digital-media-ba
University of Leeds,Digital Media MA,https://courses.leeds.ac.uk/j692/digital-media-ma
University of Leeds,Digital Media,https://courses.leeds.ac.uk/j692/digital-media-ma
University of Leeds,"Disability Studies, Rights and Inclusion MSc",https://courses.leeds.ac.uk/d326/disability-studies-rights-and-inclusion-msc
University of Leeds,"Disability Studies, Rights and Inclusion PGCert",https://courses.leeds.ac.uk/d328/disability-studies-rights-and-inclusion-pgcert
University of Leeds,"Disability Studies, Rights and Inclusion PGDip",https://courses.leeds.ac.uk/d327/disability-studies-rights-and-inclusion-pgdip
University of Leeds,Drug Discovery and Development MSc,https://courses.leeds.ac.uk/j478/drug-discovery-and-development-msc
University of Leeds,Drug Discovery and Development,https://courses.leeds.ac.uk/j478/drug-discovery-and-development-msc
University of Leeds,East Asian Studies and Chinese BA,https://courses.leeds.ac.uk/j764/east-asian-studies-and-chinese-ba
University of Leeds,East Asian Studies and International Relations BA,https://courses.leeds.ac.uk/j766/east-asian-studies-and-international-relations-ba
University of Leeds,East Asian Studies and Japanese BA,https://courses.leeds.ac.uk/j763/east-asian-studies-and-japanese-ba
University of Leeds,East Asian Studies BA,https://courses.leeds.ac.uk/j762/east-asian-studies-ba
University of Leeds,Echocardiography PGCert,https://courses.leeds.ac.uk/i536/echocardiography-pgcert
University of Leeds,Echocardiography,https://courses.leeds.ac.uk/i536/echocardiography-pgcert
University of Leeds,Ecological Economics MSc,https://courses.leeds.ac.uk/g867/ecological-economics-msc
University of Leeds,Ecological Economics,https://courses.leeds.ac.uk/g867/ecological-economics-msc
University of Leeds,Ecology and Conservation Biology BSc,https://courses.leeds.ac.uk/i077/ecology-and-conservation-biology-bsc
University of Leeds,Ecology and Conservation Biology,https://courses.leeds.ac.uk/i077/ecology-and-conservation-biology-bsc
University of Leeds,"Ecology and Conservation Biology MBiol, BSc",https://courses.leeds.ac.uk/i078/ecology-and-conservation-biology-mbiol-bsc
University of Leeds,Ecology and Conservation Biology,https://courses.leeds.ac.uk/i078/ecology-and-conservation-biology-mbiol-bsc
University of Leeds,Economics and Finance BSc,https://courses.leeds.ac.uk/g048/economics-and-finance-bsc
University of Leeds,Economics and Finance,https://courses.leeds.ac.uk/g048/economics-and-finance-bsc
University of Leeds,Economics and Finance MSc,https://courses.leeds.ac.uk/f920/economics-and-finance-msc
University of Leeds,Economics and Finance,https://courses.leeds.ac.uk/f920/economics-and-finance-msc
University of Leeds,Economics and Geography BA,https://courses.leeds.ac.uk/0930/economics-and-geography-ba
University of Leeds,Economics and Geography,https://courses.leeds.ac.uk/0930/economics-and-geography-ba
University of Leeds,Economics and History BA,https://courses.leeds.ac.uk/950/economics-and-history-ba
University of Leeds,Economics and History,https://courses.leeds.ac.uk/950/economics-and-history-ba
University of Leeds,Economics and Mathematics BSc,https://courses.leeds.ac.uk/4393/economics-and-mathematics-bsc
University of Leeds,Economics and Mathematics,https://courses.leeds.ac.uk/4393/economics-and-mathematics-bsc
University of Leeds,Economics and Politics BA,https://courses.leeds.ac.uk/1000/economics-and-politics-ba
University of Leeds,Economics and Politics,https://courses.leeds.ac.uk/1000/economics-and-politics-ba
University of Leeds,Economics BSc,https://courses.leeds.ac.uk/f836/economics-bsc
University of Leeds,Economics,https://courses.leeds.ac.uk/f836/economics-bsc
University of Leeds,Economics MSc,https://courses.leeds.ac.uk/f922/economics-msc
University of Leeds,Economics,https://courses.leeds.ac.uk/f922/economics-msc
University of Leeds,Education BA,https://courses.leeds.ac.uk/g971/education-ba
University of Leeds,Education,https://courses.leeds.ac.uk/g971/education-ba
University of Leeds,Education MA,https://courses.leeds.ac.uk/a591/education-ma
University of Leeds,Education,https://courses.leeds.ac.uk/a591/education-ma
