School Name,Department Name,URL
University of Leicester,AI for Business Intelligence MSc,https://le.ac.uk/courses/ai-for-business-intelligence-msc
University of Leicester,Accounting BSc,https://le.ac.uk/courses/accounting-bsc
University of Leicester,Accounting and Finance BSc,https://le.ac.uk/courses/accounting-and-finance-bsc
University of Leicester,Accounting and Finance MSc,https://le.ac.uk/courses/accounting-and-finance-msc
University of Leicester,"Actuarial Science with Data Analytics MSc, PGDip",https://le.ac.uk/courses/actuarial-science-with-data-analytics-msc
University of Leicester,"Advanced Computer Science MSc, PGDip, PGCert",https://le.ac.uk/courses/advanced-computer-science-msc
University of Leicester,Advanced Electrical and Electronic Engineering MSc,https://le.ac.uk/courses/advanced-electrical-and-electronic-engineering-msc
University of Leicester,Advanced Electrical and Electronic Engineering with Management MSc,https://le.ac.uk/courses/advanced-electrical-and-electronic-engineering-with-management-msc
University of Leicester,Advanced Mechanical Engineering MSc,https://le.ac.uk/courses/advanced-mechanical-engineering-msc
University of Leicester,Advanced Mechanical Engineering with Management MSc,https://le.ac.uk/courses/advanced-mechanical-engineering-with-management-msc
University of Leicester,"Advanced Software Engineering MSc, PGDip",https://le.ac.uk/courses/advanced-software-engineering-msc
University of Leicester,Aerospace Engineering BEng,https://le.ac.uk/courses/aerospace-engineering-beng
University of Leicester,Aerospace Engineering MEng,https://le.ac.uk/courses/aerospace-engineering-meng
University of Leicester,Aerospace Engineering MSc,https://le.ac.uk/courses/aerospace-engineering-msc
University of Leicester,Ancient History BA,https://le.ac.uk/courses/ancient-history-ba
University of Leicester,Ancient History and Archaeology BA,https://le.ac.uk/courses/ancient-history-and-archaeology-ba
University of Leicester,"Ancient History and Classical Archaeology BA, DipHE, CertHE, by distance learning",https://le.ac.uk/courses/ancient-history-and-classical-archaeology-ba-dl
University of Leicester,"Ancient History and Classical Archaeology MA, PGDip, PGCert, by distance learning",https://le.ac.uk/courses/ancient-history-and-classical-archaeology-ma-dl
University of Leicester,Ancient History and History BA,https://le.ac.uk/courses/ancient-history-and-history-ba
University of Leicester,"Applied Health Research MRes, PGCert",https://le.ac.uk/courses/applied-health-research-mres
University of Leicester,Applied Linguistics MOOC,https://le.ac.uk/courses/mooc-applied-linguistics
University of Leicester,"Applied Linguistics and TESOL MA, PGDip, PGCert",https://le.ac.uk/courses/applied-linguistics-tesol-ma
University of Leicester,"Applied Linguistics and TESOL MA, PGDip, PGCert, by distance learning",https://le.ac.uk/courses/applied-linguistics-and-tesol-ma-dl
University of Leicester,Applied Psychology BSc,https://le.ac.uk/courses/applied-psychology-bsc
University of Leicester,Archaeology BA,https://le.ac.uk/courses/archaeology-ba
University of Leicester,"Archaeology BA, DipHE, CertHE, by distance learning",https://le.ac.uk/courses/archaeology-ba-dl
University of Leicester,Archaeology BSc,https://le.ac.uk/courses/archaeology-bsc
University of Leicester,"Archaeology and Heritage MA, PGDip, PGCert, by distance learning",https://le.ac.uk/courses/archaeology-and-heritage-ma-dl
University of Leicester,"Art Museum and Gallery Studies MA, PGDip",https://le.ac.uk/courses/art-museum-and-gallery-studies-ma
University of Leicester,Bioinformatics MSc,https://le.ac.uk/courses/bioinformatics-msc
University of Leicester,Bioinformatics and Cancer Biology MSc,https://le.ac.uk/courses/bioinformatics-and-cancer-biology-msc
University of Leicester,Bioinformatics and Molecular Genetics MSc,https://le.ac.uk/courses/bioinformatics-and-molecular-genetics-msc
University of Leicester,Biological Sciences (Biochemistry) BSc,https://le.ac.uk/courses/biological-sciences-biochemistry-bsc
University of Leicester,Biological Sciences (Biochemistry) MBiolSci,https://le.ac.uk/courses/biological-sciences-biochemistry-mbiolsci
University of Leicester,Biological Sciences (Genetics) BSc,https://le.ac.uk/courses/biological-sciences-genetics-bsc
University of Leicester,Biological Sciences (Genetics) MBiolSci,https://le.ac.uk/courses/biological-sciences-genetics-mbiolsci
University of Leicester,Biological Sciences (Microbiology) BSc,https://le.ac.uk/courses/biological-sciences-microbiology-bsc
University of Leicester,Biological Sciences (Microbiology) MBiolSci,https://le.ac.uk/courses/biological-sciences-microbiology-mbiolsci
University of Leicester,Biological Sciences (Neuroscience) BSc,https://le.ac.uk/courses/biological-sciences-neuroscience-bsc
University of Leicester,Biological Sciences (Neuroscience) MBiolSci,https://le.ac.uk/courses/biological-sciences-neuroscience-mbiolsci
University of Leicester,Biological Sciences (Physiology with Pharmacology) BSc,https://le.ac.uk/courses/biological-sciences-physiology-with-pharmacology-bsc
University of Leicester,Biological Sciences (Physiology with Pharmacology) MBiolSci,https://le.ac.uk/courses/biological-sciences-physiology-with-pharmacology-mbiolsci
University of Leicester,Biological Sciences (Zoology) BSc,https://le.ac.uk/courses/biological-sciences-zoology-bsc
University of Leicester,Biological Sciences BSc,https://le.ac.uk/courses/biological-sciences-bsc
University of Leicester,Biological Sciences MBiolSci,https://le.ac.uk/courses/biological-sciences-mbiolsci
University of Leicester,Biological Sciences with Foundation Year BSc,https://le.ac.uk/courses/biological-sciences-with-foundation-year-bsc
University of Leicester,Biomedical Engineering BEng,https://le.ac.uk/courses/biomedical-engineering-beng
University of Leicester,Biomedical Engineering MEng,https://le.ac.uk/courses/biomedical-engineering-meng
University of Leicester,Business Analysis and Finance MSc,https://le.ac.uk/courses/business-analysis-and-finance-msc
University of Leicester,Business Economics BSc,https://le.ac.uk/courses/economics-and-business-bsc
University of Leicester,Business and Management BA,https://le.ac.uk/courses/management-studies-ba
University of Leicester,CPD Fundamentals of Space,https://le.ac.uk/courses/cpd-fundamentals-of-space
University of Leicester,CPD Pharmacist Independent Prescribing,https://le.ac.uk/courses/cpd-pharmacist-independent-prescribing
University of Leicester,Cancer Cell and Molecular Biology MSc,https://le.ac.uk/courses/cancer-cell-and-molecular-biology-msc
University of Leicester,Cancer Molecular Pathology and Therapeutics MSc,https://le.ac.uk/courses/cancer-molecular-pathology-and-therapeutics-msc
University of Leicester,Cardiovascular Science MRes,https://le.ac.uk/courses/cardiovascular-science-mres
University of Leicester,Chemistry BSc,https://le.ac.uk/courses/chemistry-bsc
University of Leicester,Chemistry MChem,https://le.ac.uk/courses/chemistry-mchem
University of Leicester,Chemistry with Foundation Year BSc,https://le.ac.uk/courses/chemistry-with-foundation-year-bsc
University of Leicester,"Clinical Education MSc, PGDip, PGCert",https://le.ac.uk/courses/clinical-education-msc
University of Leicester,Clinical Sciences BSc,https://le.ac.uk/courses/clinical-sciences-bsc
University of Leicester,"Cloud Computing MSc, PGDip",https://le.ac.uk/courses/cloud-computing-msc
University of Leicester,"Coaching Psychology MSc, by distance learning",https://le.ac.uk/courses/coaching-psychology-msc-dl
University of Leicester,"Computational Health Data Science MSc
MSc",https://le.ac.uk/courses/computational-health-data-science-msc
University of Leicester,Computer Science BSc,https://le.ac.uk/courses/computer-science-bsc
University of Leicester,Computer Science MComp,https://le.ac.uk/courses/computer-science-mcomp
University of Leicester,Computer Science with Artificial Intelligence BSc,https://le.ac.uk/courses/computer-science-with-artificial-intelligence-bsc
University of Leicester,Computer Science with Foundation Year BSc,https://le.ac.uk/courses/computer-science-with-foundation-year-bsc
University of Leicester,Concepts in Sustainable Development: an Introduction to the Key Issues MOOC,https://le.ac.uk/courses/mooc-sustainability
University of Leicester,Country Houses and the British Empire: How Imperialism Transformed Britain’s Colonial Countryside,https://le.ac.uk/courses/mooc-colonial-countryside
University of Leicester,Creative Computing BSc,https://le.ac.uk/courses/creative-computing-bsc
University of Leicester,Creative Computing with Foundation Year BSc,https://le.ac.uk/courses/creative-computing-with-foundation-year-bsc
University of Leicester,Creative Writing MA,https://le.ac.uk/courses/creative-writing-ma
University of Leicester,"Crime, Justice and Psychology MSc",https://le.ac.uk/courses/crime-justice-and-psychology-msc
University of Leicester,Criminology BSc,https://le.ac.uk/courses/criminology-bsc
University of Leicester,Criminology MSc,https://le.ac.uk/courses/criminology-msc
University of Leicester,Criminology with Forensic Psychology BSc,https://le.ac.uk/courses/criminology-with-forensic-psychology-bsc
University of Leicester,"Data Science MSc, PGDip",https://le.ac.uk/courses/data-science-msc
University of Leicester,Diabetes CPD by distance learning,https://le.ac.uk/courses/cpd-diabetes-dl
University of Leicester,"Diabetes MSc, PGDip, PGCert, by distance learning",https://le.ac.uk/courses/diabetes-msc-dl
University of Leicester,Diagnostic Radiography BSc,https://le.ac.uk/courses/diagnostic-radiography-bsc
University of Leicester,Digital Marketing MSc,https://le.ac.uk/courses/digital-marketing-msc
University of Leicester,Digital Media and Society MA,https://le.ac.uk/courses/digital-media-and-society-ma
University of Leicester,Discovering Your PhD Potential: Writing a Research Proposal MOOC,https://le.ac.uk/courses/mooc-preparing-a-phd-proposal
University of Leicester,Economics BSc,https://le.ac.uk/courses/economics-bsc
University of Leicester,Economics and Accounting BSc,https://le.ac.uk/courses/economics-and-accounting-bsc
University of Leicester,Economics and Data Analytics BSc,https://le.ac.uk/courses/economics-and-data-analytics-bsc
University of Leicester,Electrical and Electronic Engineering BEng,https://le.ac.uk/courses/electrical-and-electronic-engineering-beng
University of Leicester,Electrical and Electronic Engineering MEng,https://le.ac.uk/courses/electrical-and-electronic-engineering-meng
University of Leicester,Embedded Systems and Control Engineering MSc,https://le.ac.uk/courses/embedded-systems-and-control-engineering-msc
University of Leicester,"Employment Law LLM, PGDip, by distance learning",https://le.ac.uk/courses/employment-law-llm-dl
University of Leicester,Engineering with Foundation Year BEng,https://le.ac.uk/courses/engineering-with-foundation-year-beng
University of Leicester,England in the time of King Richard III MOOC,https://le.ac.uk/courses/mooc-england-in-the-time-of-king-richard-iii
University of Leicester,English BA,https://le.ac.uk/courses/english-ba
University of Leicester,English Football: a Social History MOOC,https://le.ac.uk/courses/mooc-english-football
University of Leicester,English Literature MA,https://le.ac.uk/courses/english-literature-ma
University of Leicester,English and American Studies BA,https://le.ac.uk/courses/english-and-american-studies-ba
University of Leicester,"English and French Law LLB, Maîtrise",https://le.ac.uk/courses/english-and-french-law-llb
University of Leicester,English and History BA,https://le.ac.uk/courses/english-and-history-ba
University of Leicester,English with Creative Writing BA,https://le.ac.uk/courses/english-with-creative-writing-ba
University of Leicester,"Environmental Data Science MSc, PGDip",https://le.ac.uk/courses/environmental-data-science-msc
University of Leicester,Environmental Futures MSc,https://le.ac.uk/courses/environmental-futures-msc
University of Leicester,Environmental Science BSc,https://le.ac.uk/courses/environmental-science-bsc
University of Leicester,Environmental Science with Foundation Year BSc,https://le.ac.uk/courses/environmental-science-with-foundation-year-bsc
University of Leicester,Environmental System Science MSc,https://le.ac.uk/courses/environmental-system-science-msc
University of Leicester,Film Studies BA,https://le.ac.uk/courses/film-studies-ba
University of Leicester,Film Studies and English BA,https://le.ac.uk/courses/film-studies-and-english-ba
University of Leicester,Film and Media Studies BA,https://le.ac.uk/courses/film-and-media-studies-ba
University of Leicester,Finance BSc,https://le.ac.uk/courses/finance-bsc
University of Leicester,Finance MSc,https://le.ac.uk/courses/finance-msc
University of Leicester,Financial Economics and Banking BSc,https://le.ac.uk/courses/financial-economics-and-banking-bsc
University of Leicester,"Forensic Science and Criminal Justice MSc, by distance learning",https://le.ac.uk/courses/forensic-science-and-criminal-justice-msc-dl
University of Leicester,General Engineering BEng,https://le.ac.uk/courses/general-engineering-beng
University of Leicester,General Engineering MEng,https://le.ac.uk/courses/general-engineering-meng
University of Leicester,"Geographical Data Science MSc, PGDip",https://le.ac.uk/courses/geographical-data-science-msc
University of Leicester,Geographical Information Science MSc,https://le.ac.uk/courses/geographical-information-science-msc
University of Leicester,Geography BA,https://le.ac.uk/courses/geography-ba
University of Leicester,Geography BSc,https://le.ac.uk/courses/geography-bsc
University of Leicester,Geography with Foundation Year BSc,https://le.ac.uk/courses/geography-with-foundation-year-bsc
University of Leicester,Geology BSc,https://le.ac.uk/courses/geology-bsc
University of Leicester,Geology MGeol,https://le.ac.uk/courses/geology-mgeol
University of Leicester,Geology with Foundation Year BSc,https://le.ac.uk/courses/geology-with-foundation-year-bsc
University of Leicester,Geology with Palaeontology BSc,https://le.ac.uk/courses/geology-with-palaeontology-bsc
University of Leicester,Geology with Palaeontology MGeol,https://le.ac.uk/courses/geology-with-palaeontology-mgeol
University of Leicester,Global Media and Communication MA,https://le.ac.uk/courses/global-media-and-communication-ma
University of Leicester,Health Law LLM,https://le.ac.uk/courses/health-law-llm
University of Leicester,Healthcare Management MSc,https://le.ac.uk/courses/healthcare-management-msc
University of Leicester,History (Holocaust and Genocide Studies) MA,https://le.ac.uk/courses/history-holocaust-and-genocide-studies-ma
University of Leicester,History (Local History) MA,https://le.ac.uk/courses/english-local-history-and-family-history-ma
University of Leicester,History (Urban History) MA,https://le.ac.uk/courses/urban-history-ma
University of Leicester,History BA,https://le.ac.uk/courses/history-ba
University of Leicester,History MA,https://le.ac.uk/courses/history-ma
University of Leicester,History MRes,https://le.ac.uk/courses/history-mres
University of Leicester,History and American Studies BA,https://le.ac.uk/courses/history-and-american-studies-ba
University of Leicester,History and Archaeology BA,https://le.ac.uk/courses/history-and-archaeology-ba
University of Leicester,History and Politics BA,https://le.ac.uk/courses/history-and-politics-ba
University of Leicester,Human Geography BA,https://le.ac.uk/courses/human-geography-ba
University of Leicester,Human Resource Management BA,https://le.ac.uk/courses/human-resource-management-ba
University of Leicester,Human Resource Management BSc by distance learning,https://le.ac.uk/courses/human-resource-management-bsc-dl
University of Leicester,Human Resource Management Diploma (HE) by distance learning,https://le.ac.uk/courses/human-resource-management-diploma-dl
University of Leicester,Human Resource Management and Training MSc,https://le.ac.uk/courses/human-resource-management-and-training-msc
University of Leicester,"Human Resource Management and Training MSc, PGDip, by distance learning",https://le.ac.uk/courses/human-resource-management-and-training-msc-dl
University of Leicester,Human Rights and Global Ethics MA,https://le.ac.uk/courses/human-rights-and-global-ethics-ma
University of Leicester,"Human Rights and Global Ethics MA, PGDip, PGCert, by distance learning",https://le.ac.uk/courses/human-rights-and-global-ethics-ma-dl
University of Leicester,"Immunity, Infection and Chronic Disease MSc",https://le.ac.uk/courses/infection-and-immunity-msc
University of Leicester,"Intelligence and Security MA, by distance learning",https://le.ac.uk/courses/intelligence-and-security-ma-dl
University of Leicester,International Business MSc,https://le.ac.uk/courses/international-business-msc
University of Leicester,International Business and Corporate Law LLM,https://le.ac.uk/courses/international-business-and-corporate-law-llm
University of Leicester,International Commercial Law LLM,https://le.ac.uk/courses/international-commercial-law-llm
University of Leicester,International Education (with specialist routes) MA,https://le.ac.uk/courses/international-education-ma
University of Leicester,"International Education MA, by distance learning",https://le.ac.uk/courses/international-education-ma-dl
University of Leicester,International Human Rights Law LLM,https://le.ac.uk/courses/international-human-rights-law-llm
University of Leicester,International Law LLM,https://le.ac.uk/courses/international-law-llm
University of Leicester,International Management MSc,https://le.ac.uk/courses/international-management-msc
University of Leicester,International Relations BA,https://le.ac.uk/courses/international-relations-ba
University of Leicester,International Relations MA,https://le.ac.uk/courses/international-relations-ma
University of Leicester,International Relations and History BA,https://le.ac.uk/courses/international-relations-and-history-ba
University of Leicester,"International Relations and World Order MA, PGDip, PGCert, by distance learning",https://le.ac.uk/courses/international-relations-and-world-order-ma-dl
University of Leicester,International Security Studies MA,https://le.ac.uk/courses/international-security-ma
University of Leicester,International Year One Business and Management,https://le.ac.uk/courses/international-year-one-business-and-management
University of Leicester,International Year One Human Resource Management,https://le.ac.uk/courses/international-year-one-human-resource-management
University of Leicester,International Year One Marketing,https://le.ac.uk/courses/international-year-one-marketing
University of Leicester,Journalism BA,https://le.ac.uk/courses/journalism-ba
University of Leicester,Journalism and English BA,https://le.ac.uk/courses/journalism-and-english-ba
University of Leicester,Journalism and Marketing BA,https://le.ac.uk/courses/journalism-and-marketing-ba
University of Leicester,Journalism and Media BA,https://le.ac.uk/courses/journalism-and-media-ba
University of Leicester,Journalism with Creative Writing BA,https://le.ac.uk/courses/journalism-with-creative-writing-ba
University of Leicester,Law (Graduate Entry) LLB,https://le.ac.uk/courses/law-graduate-entry-llb
University of Leicester,Law (JD Pathway) LLB,https://le.ac.uk/courses/law-jd-pathway-llb
University of Leicester,Law LLB,https://le.ac.uk/courses/law-llb
University of Leicester,Law LLB (Canadian stream),https://le.ac.uk/courses/law-canadian-llb
University of Leicester,Law with Criminology LLB,https://le.ac.uk/courses/law-and-criminology-llb
University of Leicester,Law with Politics LLB,https://le.ac.uk/courses/law-with-politics-llb
University of Leicester,Law with a Modern Language LLB,https://le.ac.uk/courses/law-with-a-modern-language-llb
University of Leicester,Management MSc,https://le.ac.uk/courses/management-msc
University of Leicester,"Management, Finance and Accounting MSc",https://le.ac.uk/courses/management-finance-and-accounting-msc
University of Leicester,Marketing BA,https://le.ac.uk/courses/marketing-ba
University of Leicester,Marketing MSc,https://le.ac.uk/courses/marketing-msc
University of Leicester,Mass Communications MA,https://le.ac.uk/courses/mass-communications-ma
University of Leicester,"Master of Business Administration MBA, by distance learning",https://le.ac.uk/courses/the-leicester-mba-dl
University of Leicester,"Master of Education MEd, PGDip, PGCert, by flexible learning",https://le.ac.uk/courses/master-of-education-med
University of Leicester,Master of Engineering Management MEM,https://le.ac.uk/courses/master-of-engineering-management-mem
University of Leicester,Master of Laws (LLM),https://le.ac.uk/courses/law-llm
University of Leicester,Mathematics BSc,https://le.ac.uk/courses/mathematics-ba-bsc
University of Leicester,Mathematics MMath,https://le.ac.uk/courses/mathematics-mmath
University of Leicester,Mathematics and Actuarial Science BSc,https://le.ac.uk/courses/mathematics-and-actuarial-science-bsc
University of Leicester,Mathematics and Actuarial Science MMath,https://le.ac.uk/courses/mathematics-and-actuarial-science-mmath
University of Leicester,Mathematics with Foundation Year BSc,https://le.ac.uk/courses/mathematics-with-foundation-year-bsc
University of Leicester,Mechanical Engineering BEng,https://le.ac.uk/courses/mechanical-engineering-beng
University of Leicester,Mechanical Engineering MEng,https://le.ac.uk/courses/mechanical-engineering-meng
University of Leicester,Media and Advertising MA,https://le.ac.uk/courses/media-and-advertising-ma
University of Leicester,Media and Communication BA,https://le.ac.uk/courses/media-and-communication-ba
University of Leicester,Media and Public Relations MA,https://le.ac.uk/courses/media-and-public-relations-ma
University of Leicester,"Media and Public Relations MA, by distance learning",https://le.ac.uk/courses/media-and-public-relations-ma-dl
University of Leicester,"Media, Culture and Society MA",https://le.ac.uk/courses/media-culture-and-society-ma
University of Leicester,"Media, Society and Culture BA",https://le.ac.uk/courses/media-and-society-ba
University of Leicester,Medical Biochemistry BSc,https://le.ac.uk/courses/medical-biochemistry-bsc
University of Leicester,Medical Biosciences (Biochemistry) MBiolSci,https://le.ac.uk/courses/medical-biosciences-biochemistry-mbiolsci
University of Leicester,Medical Biosciences (Genetics) MBiolSci,https://le.ac.uk/courses/medical-biosciences-genetics-mbiolsci
University of Leicester,Medical Biosciences (Microbiology) MBiolSci,https://le.ac.uk/courses/medical-biosciences-microbiology-mbiolsci
University of Leicester,Medical Biosciences (Physiology) MBiolSci,https://le.ac.uk/courses/medical-biosciences-physiology-mbiolsci
University of Leicester,Medical Genetics BSc,https://le.ac.uk/courses/medical-genetics-bsc
University of Leicester,Medical Microbiology BSc,https://le.ac.uk/courses/medical-microbiology-bsc
University of Leicester,Medical Physiology BSc,https://le.ac.uk/courses/medical-physiology-bsc
University of Leicester,Medical Research MSc (intercalated),https://le.ac.uk/courses/medical-research-msc
University of Leicester,Medical Statistics MSc,https://le.ac.uk/courses/medical-statistics-msc
University of Leicester,Medicinal Chemistry BSc,https://le.ac.uk/courses/medicinal-chemistry-bsc
University of Leicester,Medicinal Chemistry MChem,https://le.ac.uk/courses/medicinal-chemistry-mchem
University of Leicester,Medicine MBChB,https://le.ac.uk/courses/medicine-mbchb
University of Leicester,Medicine with Foundation Year MBChB,https://le.ac.uk/courses/medicine-with-foundation-year-mbchb
University of Leicester,Methods in Applied Health Research CPD,https://le.ac.uk/courses/cpd-quantitative-and-qualitative-research-methods
University of Leicester,Midwifery with Leadership MSci,https://le.ac.uk/courses/midwifery-msci
University of Leicester,Modern Languages BA,https://le.ac.uk/courses/modern-languages-ba
University of Leicester,Modern Languages and English BA,https://le.ac.uk/courses/modern-languages-and-english-ba
University of Leicester,Modern Languages and International Relations BA,https://le.ac.uk/courses/modern-languages-and-international-relations-ba
University of Leicester,Modern Languages and Translation BA,https://le.ac.uk/courses/modern-languages-and-translation-ba
University of Leicester,Modern Languages with Film Studies BA,https://le.ac.uk/courses/modern-languages-with-film-studies-ba
University of Leicester,Modern Languages with Management BA,https://le.ac.uk/courses/modern-languages-with-management-ba
University of Leicester,Modern and Contemporary History BA,https://le.ac.uk/courses/contemporary-history-ba
University of Leicester,Modern and Contemporary Literature (and optional Creative Writing) MA,https://le.ac.uk/courses/modern-literature-and-creative-writing-ma
University of Leicester,Molecular Genetics MSc,https://le.ac.uk/courses/molecular-genetics-msc
University of Leicester,"Museum Studies (Hong Kong) MA, MSc, PGDip, PGCert, short course by distance learning",https://le.ac.uk/courses/museum-studies-hong-kong-ma-msc-dl
University of Leicester,"Museum Studies MA, MSc, PGDip",https://le.ac.uk/courses/museum-studies-ma-msc
University of Leicester,"Museum Studies MA, MSc, PGDip, PGCert, short course, by distance learning",https://le.ac.uk/courses/museum-studies-ma-msc-dl
University of Leicester,Nursing with Leadership Dual Field (Mental Health and Adult Nursing) MSci,https://le.ac.uk/courses/nursing-msci-adult
University of Leicester,Nursing with Leadership Dual Field (Mental Health and Children's Nursing) MSci,https://le.ac.uk/courses/nursing-msci-child
University of Leicester,Nursing with Leadership Single Field (Adult Nursing) MSci,https://le.ac.uk/courses/nursing-msci-adult-single
University of Leicester,"Occupational Psychology MSc, by distance learning",https://le.ac.uk/courses/occupational-psychology-msc-dl
