School Name,Department Name,URL
University of Leeds,Accounting and Finance BSc,https://courses.leeds.ac.uk/f834/accounting-and-finance-bsc
University of Leeds,Accounting and Finance,https://courses.leeds.ac.uk/f834/accounting-and-finance-bsc
University of Leeds,Accounting and Finance MSc,https://courses.leeds.ac.uk/f921/accounting-and-finance-msc
University of Leeds,Accounting and Finance,https://courses.leeds.ac.uk/f921/accounting-and-finance-msc
University of Leeds,Actuarial Mathematics BSc,https://courses.leeds.ac.uk/f702/actuarial-mathematics-bsc
University of Leeds,Actuarial Mathematics,https://courses.leeds.ac.uk/f702/actuarial-mathematics-bsc
University of Leeds,Advanced Chemical Engineering MSc,https://courses.leeds.ac.uk/i239/advanced-chemical-engineering-msc
University of Leeds,Advanced Chemical Engineering,https://courses.leeds.ac.uk/i239/advanced-chemical-engineering-msc
University of Leeds,Advanced Clinical Practice (Apprenticeship) MSc,https://courses.leeds.ac.uk/ap11/advanced-clinical-practice-apprenticeship-msc
University of Leeds,Advanced Clinical Practice (Apprenticeship),https://courses.leeds.ac.uk/ap11/advanced-clinical-practice-apprenticeship-msc
University of Leeds,Advanced Clinical Practice MSc,https://courses.leeds.ac.uk/h811/advanced-clinical-practice-msc
University of Leeds,Advanced Clinical Practice,https://courses.leeds.ac.uk/h811/advanced-clinical-practice-msc
University of Leeds,Advanced Computer Science (Artificial Intelligence) MSc,https://courses.leeds.ac.uk/i537/advanced-computer-science-artificial-intelligence-msc
University of Leeds,Advanced Computer Science (Artificial Intelligence),https://courses.leeds.ac.uk/i537/advanced-computer-science-artificial-intelligence-msc
University of Leeds,Advanced Computer Science (Cloud Computing) MSc,https://courses.leeds.ac.uk/g313/advanced-computer-science-cloud-computing-msc
University of Leeds,Advanced Computer Science (Cloud Computing),https://courses.leeds.ac.uk/g313/advanced-computer-science-cloud-computing-msc
University of Leeds,Advanced Computer Science (Data Analytics) MSc,https://courses.leeds.ac.uk/g314/advanced-computer-science-data-analytics-msc
University of Leeds,Advanced Computer Science (Data Analytics),https://courses.leeds.ac.uk/g314/advanced-computer-science-data-analytics-msc
University of Leeds,Advanced Computer Science MSc,https://courses.leeds.ac.uk/f753/advanced-computer-science-msc
University of Leeds,Advanced Computer Science,https://courses.leeds.ac.uk/f753/advanced-computer-science-msc
University of Leeds,Advanced Mechanical Engineering MSc (Eng),https://courses.leeds.ac.uk/f360/advanced-mechanical-engineering-msc-eng-
University of Leeds,Advanced Mechanical Engineering,https://courses.leeds.ac.uk/f360/advanced-mechanical-engineering-msc-eng-
University of Leeds,"Advanced Psychology MPsyc, BSc",https://courses.leeds.ac.uk/g492/advanced-psychology-mpsyc-bsc
University of Leeds,"Advanced Psychology MPsyc, BSc",https://courses.leeds.ac.uk/g492/www.bps.org.uk/accreditation
University of Leeds,Advanced Psychology,https://courses.leeds.ac.uk/g492/advanced-psychology-mpsyc-bsc
University of Leeds,Advertising and Design MA,https://courses.leeds.ac.uk/f296/advertising-and-design-ma
University of Leeds,Advertising and Design,https://courses.leeds.ac.uk/f296/advertising-and-design-ma
University of Leeds,Advertising and Marketing,https://courses.leeds.ac.uk/7002/advertising-and-marketing-ma
University of Leeds,Aeronautical and Aerospace Engineering (Industrial) BEng,https://courses.leeds.ac.uk/g662/aeronautical-and-aerospace-engineering-industrial-beng
University of Leeds,"Aeronautical and Aerospace Engineering (Industrial) MEng, BEng",https://courses.leeds.ac.uk/g285/aeronautical-and-aerospace-engineering-industrial-meng-beng
University of Leeds,Aeronautical and Aerospace Engineering BEng,https://courses.leeds.ac.uk/a225/aeronautical-and-aerospace-engineering-beng
University of Leeds,"Aeronautical and Aerospace Engineering MEng, BEng",https://courses.leeds.ac.uk/f414/aeronautical-and-aerospace-engineering-meng-beng
University of Leeds,Aeronautical and Aerospace Engineering,https://courses.leeds.ac.uk/f414/aeronautical-and-aerospace-engineering-meng-beng
University of Leeds,Aerospace Engineering MSc,https://courses.leeds.ac.uk/g600/aerospace-engineering-msc
University of Leeds,Aerospace Engineering,https://courses.leeds.ac.uk/g600/aerospace-engineering-msc
University of Leeds,Air Quality Solutions with Data Science MSc,https://courses.leeds.ac.uk/j836/air-quality-solutions-with-data-science-msc
University of Leeds,Ancient History and English BA,https://courses.leeds.ac.uk/g675/ancient-history-and-english-ba
University of Leeds,Ancient History and English,https://courses.leeds.ac.uk/g675/ancient-history-and-english-ba
University of Leeds,Ancient History and History BA,https://courses.leeds.ac.uk/g676/ancient-history-and-history-ba
University of Leeds,Ancient History and History,https://courses.leeds.ac.uk/g676/ancient-history-and-history-ba
University of Leeds,Ancient History and Philosophy BA,https://courses.leeds.ac.uk/g678/ancient-history-and-philosophy-ba
University of Leeds,Ancient History and Philosophy,https://courses.leeds.ac.uk/g678/ancient-history-and-philosophy-ba
University of Leeds,Ancient History BA,https://courses.leeds.ac.uk/i988/ancient-history-ba
University of Leeds,Ancient History,https://courses.leeds.ac.uk/i988/ancient-history-ba
University of Leeds,Applied and Professional Ethics MA,https://courses.leeds.ac.uk/f847/applied-and-professional-ethics-ma
University of Leeds,Applied and Professional Ethics,https://courses.leeds.ac.uk/f847/applied-and-professional-ethics-ma
University of Leeds,Applied and Professional Ethics PGDip,https://courses.leeds.ac.uk/f849/applied-and-professional-ethics-pgdip
University of Leeds,Applied and Professional Ethics,https://courses.leeds.ac.uk/f849/applied-and-professional-ethics-pgdip
University of Leeds,Applied Health (Medical Education),https://courses.leeds.ac.uk/g165/applied-health-medical-education-bsc
University of Leeds,Applied Psychology of Music MA,https://courses.leeds.ac.uk/g533/applied-psychology-of-music-ma
University of Leeds,Applied Psychology of Music,https://courses.leeds.ac.uk/g533/applied-psychology-of-music-ma
University of Leeds,Applied Theatre and Intervention,https://courses.leeds.ac.uk/g695/applied-theatre-and-intervention-ma
University of Leeds,Applied Theatre and Social Change MA,https://courses.leeds.ac.uk/j845/applied-theatre-and-social-change-ma
University of Leeds,Applied Translation Studies MA,https://courses.leeds.ac.uk/8257/applied-translation-studies-ma
University of Leeds,Applied Translation Studies,https://courses.leeds.ac.uk/8257/applied-translation-studies-ma
University of Leeds,Arabic and Chinese BA,https://courses.leeds.ac.uk/632/arabic-and-chinese-ba
University of Leeds,Arabic and Chinese,https://courses.leeds.ac.uk/632/arabic-and-chinese-ba
University of Leeds,Arabic and Japanese BA,https://courses.leeds.ac.uk/631/arabic-and-japanese-ba
University of Leeds,Arabic and Japanese,https://courses.leeds.ac.uk/631/arabic-and-japanese-ba
University of Leeds,Arabic and Portuguese,https://courses.leeds.ac.uk/710/arabic-and-portuguese-ba
University of Leeds,Arabic and Russian A,https://courses.leeds.ac.uk/g690/arabic-and-russian-a-ba
University of Leeds,Arabic and Russian B,https://courses.leeds.ac.uk/e706/arabic-and-russian-b-ba
University of Leeds,Arabic and Russian BA,https://courses.leeds.ac.uk/j945/arabic-and-russian-ba
University of Leeds,"Arabic, Islamic, Middle Eastern and North African Studies BA",https://courses.leeds.ac.uk/j555/arabic-islamic-middle-eastern-and-north-african-studies-ba
University of Leeds,"Arabic, Islamic, Middle Eastern and North African Studies",https://courses.leeds.ac.uk/j555/arabic-islamic-middle-eastern-and-north-african-studies-ba
University of Leeds,Arabic/English Translation,https://courses.leeds.ac.uk/g402/arabic-english-translation-ma
University of Leeds,Architectural Engineering (Industrial) BEng,https://courses.leeds.ac.uk/i143/architectural-engineering-industrial-beng
University of Leeds,"Architectural Engineering (Industrial) MEng, BEng",https://courses.leeds.ac.uk/g652/architectural-engineering-industrial-meng-beng
University of Leeds,Architectural Engineering BEng,https://courses.leeds.ac.uk/a248/architectural-engineering-beng
University of Leeds,"Architectural Engineering MEng, BEng",https://courses.leeds.ac.uk/f416/architectural-engineering-meng-beng
University of Leeds,Architectural Engineering,https://courses.leeds.ac.uk/f416/architectural-engineering-meng-beng
University of Leeds,"Architecture (Industrial) MEng, BEng",https://courses.leeds.ac.uk/i870/architecture-industrial-meng-beng
University of Leeds,Architecture Design MSc,https://courses.leeds.ac.uk/j928/architecture-design-msc
University of Leeds,"Architecture MEng, BEng",https://courses.leeds.ac.uk/g800/architecture-meng-beng
University of Leeds,Architecture,https://courses.leeds.ac.uk/g800/architecture-meng-beng
University of Leeds,Art and Design BA,https://courses.leeds.ac.uk/f254/art-and-design-ba
University of Leeds,Art and Design,https://courses.leeds.ac.uk/f254/art-and-design-ba
University of Leeds,Art Gallery and Museum Studies MA,https://courses.leeds.ac.uk/a241/art-gallery-and-museum-studies-ma
University of Leeds,Art Gallery and Museum Studies,https://courses.leeds.ac.uk/a241/art-gallery-and-museum-studies-ma
University of Leeds,Artificial Intelligence,https://courses.leeds.ac.uk/d995/artificial-intelligence-msc
University of Leeds,Artificial Intelligence MSc,https://courses.leeds.ac.uk/d995/artificial-intelligence-msc?utm_source=coursefinder&utm_medium=page&utm_campaign=AIonlineMSc
University of Leeds,Artificial Intelligence PGCert,https://courses.leeds.ac.uk/d997/artificial-intelligence-postgraduate-certificate?utm_source=coursefinder&utm_medium=page&utm_campaign=AIonlinePGCert
University of Leeds,Artificial Intelligence,https://courses.leeds.ac.uk/d997/artificial-intelligence-postgraduate-certificate
University of Leeds,Arts and Humanities with Foundation Year BA,https://courses.leeds.ac.uk/g294/arts-and-humanities-with-foundation-year-ba
University of Leeds,Arts and Humanities with Foundation Year,https://courses.leeds.ac.uk/g294/arts-and-humanities-with-foundation-year-ba
University of Leeds,Arts Fundraising and Philanthropy PGCert,https://courses.leeds.ac.uk/g739/arts-fundraising-and-philanthropy-pgcert
University of Leeds,Arts Fundraising and Philanthropy,https://courses.leeds.ac.uk/g739/arts-fundraising-and-philanthropy-pgcert
University of Leeds,Arts Management and Heritage Studies MA,https://courses.leeds.ac.uk/g646/arts-management-and-heritage-studies-ma
University of Leeds,Arts Management and Heritage Studies,https://courses.leeds.ac.uk/g646/arts-management-and-heritage-studies-ma
University of Leeds,Asia Pacific Studies and Chinese,https://courses.leeds.ac.uk/0778/asia-pacific-studies-and-chinese-ba
University of Leeds,Asia Pacific Studies and International Relations,https://courses.leeds.ac.uk/e022/asia-pacific-studies-and-international-relations-ba
University of Leeds,Asia Pacific Studies and Japanese,https://courses.leeds.ac.uk/f766/asia-pacific-studies-and-japanese-ba
University of Leeds,Asia Pacific Studies,https://courses.leeds.ac.uk/e880/asia-pacific-studies-ba
University of Leeds,Astrophysics MSc,https://courses.leeds.ac.uk/j790/astrophysics-msc
University of Leeds,"Audiences, Engagement, Participation MA","https://courses.leeds.ac.uk/i521/audiences,-engagement,-participation-ma"
University of Leeds,"Audiences, Engagement, Participation",https://courses.leeds.ac.uk/i521/audiences-engagement-participation-ma
University of Leeds,"Audiences, Engagement, Participation PGCert",https://courses.leeds.ac.uk/i525/audiences-engagement-participation-pgcert
University of Leeds,"Audiences, Engagement, Participation",https://courses.leeds.ac.uk/i525/audiences-engagement-participation-pgcert
University of Leeds,"Audiences, Engagement, Participation PGDip",https://courses.leeds.ac.uk/i523/audiences-engagement-participation-pgdip
University of Leeds,"Audiences, Engagement, Participation",https://courses.leeds.ac.uk/i523/audiences-engagement-participation-pgdip
University of Leeds,Audiology BSc,https://courses.leeds.ac.uk/j568/audiology-bsc
University of Leeds,Audiology,https://courses.leeds.ac.uk/j568/audiology-bsc
University of Leeds,Audiovisual Translation and Localisation MA,https://courses.leeds.ac.uk/j548/audiovisual-translation-and-localisation-ma
University of Leeds,Audiovisual Translation and Localisation,https://courses.leeds.ac.uk/j548/audiovisual-translation-and-localisation-ma
University of Leeds,Automotive Engineering (Industrial) BEng,https://courses.leeds.ac.uk/i038/automotive-engineering-industrial-beng
University of Leeds,"Automotive Engineering (Industrial) MEng, BEng",https://courses.leeds.ac.uk/g287/automotive-engineering-industrial-meng-beng
University of Leeds,Automotive Engineering BEng,https://courses.leeds.ac.uk/4794/automotive-engineering-beng
University of Leeds,"Automotive Engineering MEng, BEng",https://courses.leeds.ac.uk/f413/automotive-engineering-meng-beng
University of Leeds,Automotive Engineering,https://courses.leeds.ac.uk/f413/automotive-engineering-meng-beng
University of Leeds,Automotive Engineering MSc (Eng),https://courses.leeds.ac.uk/8665/automotive-engineering-msc-eng-
University of Leeds,Automotive Engineering,https://courses.leeds.ac.uk/8665/automotive-engineering-msc-eng-
University of Leeds,Aviation Technology with Pilot Studies and Management,https://courses.leeds.ac.uk/i692/aviation-technology-with-pilot-studies-and-management-beng
University of Leeds,Bachelor Degree with Integrated International Foundation Year (Arts and Social Science),https://courses.leeds.ac.uk/j054/bachelor-degree-with-integrated-international-foundation-year-arts-and-social-science-ba
University of Leeds,Bachelor Degree with Integrated International Foundation Year (Arts and Social Science) BA,https://courses.leeds.ac.uk/j054/bachelor-degree-with-integrated-international-foundation-year-arts-and-social-science-ba
University of Leeds,Bachelor Degree with Integrated International Foundation Year (Business),https://courses.leeds.ac.uk/j055/bachelor-degree-with-integrated-international-foundation-year-business-ba
University of Leeds,Bachelor Degree with Integrated International Foundation Year (Business) BA,https://courses.leeds.ac.uk/j055/bachelor-degree-with-integrated-international-foundation-year-business-ba
University of Leeds,Bachelor Degree with Integrated International Foundation Year (Design),https://courses.leeds.ac.uk/j057/bachelor-degree-with-integrated-international-foundation-year-design-ba
University of Leeds,Bachelor Degree with Integrated International Foundation Year (Design) BA,https://courses.leeds.ac.uk/j057/bachelor-degree-with-integrated-international-foundation-year-design-ba
University of Leeds,Bachelor Degree with Integrated International Foundation Year (Engineering),https://courses.leeds.ac.uk/j058/bachelor-degree-with-integrated-international-foundation-year-engineering-beng
University of Leeds,Bachelor Degree with Integrated International Foundation Year (Engineering) BEng,https://courses.leeds.ac.uk/j058/bachelor-degree-with-integrated-international-foundation-year-engineering-beng
University of Leeds,Bachelor Degree with Integrated International Foundation Year (Healthcare),https://courses.leeds.ac.uk/j059/bachelor-degree-with-integrated-international-foundation-year-healthcare-bsc
University of Leeds,Bachelor Degree with Integrated International Foundation Year (Healthcare) BSc,https://courses.leeds.ac.uk/j059/bachelor-degree-with-integrated-international-foundation-year-healthcare-bsc
University of Leeds,Bachelor Degree with Integrated International Foundation Year (Science),https://courses.leeds.ac.uk/j061/bachelor-degree-with-integrated-international-foundation-year-science-bsc
University of Leeds,Bachelor Degree with Integrated International Foundation Year (Science) BSc,https://courses.leeds.ac.uk/j061/bachelor-degree-with-integrated-international-foundation-year-science-bsc
University of Leeds,Banking and Finance BSc,https://courses.leeds.ac.uk/g986/banking-and-finance-bsc
University of Leeds,Banking and Finance,https://courses.leeds.ac.uk/g986/banking-and-finance-bsc
University of Leeds,Banking and International Finance MSc,https://courses.leeds.ac.uk/g146/banking-and-international-finance-msc
University of Leeds,Banking and International Finance,https://courses.leeds.ac.uk/g146/banking-and-international-finance-msc
University of Leeds,Biochemistry BSc,https://courses.leeds.ac.uk/3130/biochemistry-bsc
University of Leeds,Biochemistry,https://courses.leeds.ac.uk/3130/biochemistry-bsc
University of Leeds,"Biochemistry MBiol, BSc",https://courses.leeds.ac.uk/g257/biochemistry-mbiol-bsc
University of Leeds,Biochemistry,https://courses.leeds.ac.uk/g257/biochemistry-mbiol-bsc
University of Leeds,Biodiversity and Conservation MSc,https://courses.leeds.ac.uk/x006/biodiversity-and-conservation-msc
University of Leeds,Biodiversity and Conservation,https://courses.leeds.ac.uk/x006/biodiversity-and-conservation-msc
University of Leeds,Biodiversity and Conservation with African Field Course MSc,https://courses.leeds.ac.uk/g363/biodiversity-and-conservation-with-african-field-course-msc
University of Leeds,Biodiversity and Conservation with African Field Course,https://courses.leeds.ac.uk/g363/biodiversity-and-conservation-with-african-field-course-msc
University of Leeds,Biological Sciences (Biotechnology with Enterprise) BSc,https://courses.leeds.ac.uk/g377/biological-sciences-biotechnology-with-enterprise-bsc
University of Leeds,Biological Sciences (Biotechnology with Enterprise),https://courses.leeds.ac.uk/g377/biological-sciences-biotechnology-with-enterprise-bsc
University of Leeds,"Biological Sciences (Biotechnology with Enterprise) MBiol, BSc",https://courses.leeds.ac.uk/g378/biological-sciences-biotechnology-with-enterprise-mbiol-bsc
University of Leeds,Biological Sciences (Biotechnology with Enterprise),https://courses.leeds.ac.uk/g378/biological-sciences-biotechnology-with-enterprise-mbiol-bsc
University of Leeds,Biological Sciences BSc,https://courses.leeds.ac.uk/e997/biological-sciences-bsc
University of Leeds,Biological Sciences,https://courses.leeds.ac.uk/e997/biological-sciences-bsc
University of Leeds,"Biological Sciences MBiol, BSc",https://courses.leeds.ac.uk/g258/biological-sciences-mbiol-bsc
University of Leeds,Biological Sciences,https://courses.leeds.ac.uk/g258/biological-sciences-mbiol-bsc
University of Leeds,Biology and History and Philosophy of Science BSc,https://courses.leeds.ac.uk/4028/biology-and-history-and-philosophy-of-science-bsc
University of Leeds,Biology and History and Philosophy of Science,https://courses.leeds.ac.uk/4028/biology-and-history-and-philosophy-of-science-bsc
University of Leeds,Biology BSc,https://courses.leeds.ac.uk/3165/biology-bsc
University of Leeds,Biology,https://courses.leeds.ac.uk/3165/biology-bsc
University of Leeds,"Biology MBiol, BSc",https://courses.leeds.ac.uk/g259/biology-mbiol-bsc
University of Leeds,Biology,https://courses.leeds.ac.uk/g259/biology-mbiol-bsc
University of Leeds,Biomedical and Healthcare Ethics BA,https://courses.leeds.ac.uk/g601/biomedical-and-healthcare-ethics-ba
University of Leeds,Biomedical and Healthcare Ethics,https://courses.leeds.ac.uk/g601/biomedical-and-healthcare-ethics-ba
University of Leeds,Biomedical and Healthcare Ethics MA,https://courses.leeds.ac.uk/g607/biomedical-and-healthcare-ethics-ma
University of Leeds,Biomedical and Healthcare Ethics MA,https://courses.leeds.ac.uk/g554/biomedical-and-healthcare-ethics-ma
University of Leeds,Biomedical and Healthcare Ethics,https://courses.leeds.ac.uk/g607/biomedical-and-healthcare-ethics-ma
University of Leeds,Biomedical and Healthcare Ethics,https://courses.leeds.ac.uk/g554/biomedical-and-healthcare-ethics-ma
University of Leeds,Biomedical and Healthcare Ethics,https://courses.leeds.ac.uk/i022/biomedical-and-healthcare-ethics-mres
University of Leeds,Biomedical and Healthcare Ethics,https://courses.leeds.ac.uk/d964/biomedical-and-healthcare-ethics-mres
University of Leeds,Biomedical and Healthcare Ethics PGDip,https://courses.leeds.ac.uk/g556/biomedical-and-healthcare-ethics-pgdip
University of Leeds,Biomedical and Healthcare Ethics PGDip,https://courses.leeds.ac.uk/g609/biomedical-and-healthcare-ethics-pgdip
University of Leeds,Biomedical and Healthcare Ethics,https://courses.leeds.ac.uk/g609/biomedical-and-healthcare-ethics-pgdip
University of Leeds,Biomedical and Healthcare Ethics,https://courses.leeds.ac.uk/g556/biomedical-and-healthcare-ethics-pgdip
University of Leeds,Biomedical Sciences BSc,https://courses.leeds.ac.uk/j415/biomedical-sciences-bsc
University of Leeds,Biomedical Sciences,https://courses.leeds.ac.uk/j415/biomedical-sciences-bsc
University of Leeds,"Biomedical Sciences MBiol, BSc",https://courses.leeds.ac.uk/j416/biomedical-sciences-mbiol-bsc
University of Leeds,Biomedical Sciences,https://courses.leeds.ac.uk/j416/biomedical-sciences-mbiol-bsc
University of Leeds,Biopharmaceutical Development (Industrial Placement) MSc,https://courses.leeds.ac.uk/i921/biopharmaceutical-development-industrial-placement-msc
University of Leeds,Biopharmaceutical Development (Industrial Placement),https://courses.leeds.ac.uk/i921/biopharmaceutical-development-industrial-placement-msc
University of Leeds,Biopharmaceutical Development MSc,https://courses.leeds.ac.uk/i922/biopharmaceutical-development-msc
University of Leeds,Biopharmaceutical Development,https://courses.leeds.ac.uk/i922/biopharmaceutical-development-msc
University of Leeds,Bioscience MSc,https://courses.leeds.ac.uk/a990/bioscience-msc
University of Leeds,Bioscience,https://courses.leeds.ac.uk/a990/bioscience-msc
University of Leeds,Biotechnology with Business Enterprise MSc,https://courses.leeds.ac.uk/j480/biotechnology-with-business-enterprise-msc
University of Leeds,Biotechnology with Business Enterprise,https://courses.leeds.ac.uk/j480/biotechnology-with-business-enterprise-msc
University of Leeds,Business Analytics and Decision Sciences MSc,https://courses.leeds.ac.uk/g503/business-analytics-and-decision-sciences-msc
University of Leeds,Business Analytics and Decision Sciences,https://courses.leeds.ac.uk/g503/business-analytics-and-decision-sciences-msc
University of Leeds,Business and Public Service Interpreting and Translation Studies,https://courses.leeds.ac.uk/i409/business-and-public-service-interpreting-and-translation-studies-ma
University of Leeds,Business and Public Service Interpreting and Translation Studies MA,https://courses.leeds.ac.uk/i409/business-and-public-service-interpreting-and-translation-studies-ma
University of Leeds,Business Economics BSc,https://courses.leeds.ac.uk/f835/business-economics-bsc
University of Leeds,Business Economics,https://courses.leeds.ac.uk/f835/business-economics-bsc
University of Leeds,Business Management and Leadership BSc,https://courses.leeds.ac.uk/i079/business-management-and-leadership-bsc
University of Leeds,Business Management and Leadership,https://courses.leeds.ac.uk/i079/business-management-and-leadership-bsc
University of Leeds,Business Management and the Human Resource BA,https://courses.leeds.ac.uk/i477/business-management-and-the-human-resource-ba
University of Leeds,Business Management and the Human Resource,https://courses.leeds.ac.uk/i477/business-management-and-the-human-resource-ba
University of Leeds,Business Management BA,https://courses.leeds.ac.uk/i475/business-management-ba
University of Leeds,Business Management,https://courses.leeds.ac.uk/i475/business-management-ba
University of Leeds,Business Management with Marketing BA,https://courses.leeds.ac.uk/i476/business-management-with-marketing-ba
University of Leeds,Business Management with Marketing,https://courses.leeds.ac.uk/i476/business-management-with-marketing-ba
University of Leeds,Business Studies with Foundation Year BSc,https://courses.leeds.ac.uk/g150/business-studies-with-foundation-year-bsc
University of Leeds,Business Studies with Foundation Year,https://courses.leeds.ac.uk/g150/business-studies-with-foundation-year-bsc
University of Leeds,Cancer Biology and Therapy MSc,https://courses.leeds.ac.uk/i873/cancer-biology-and-therapy-msc
University of Leeds,Cancer Biology and Therapy,https://courses.leeds.ac.uk/i873/cancer-biology-and-therapy-msc
University of Leeds,Cardiac Device and Rhythm Management PGCert,https://courses.leeds.ac.uk/i414/cardiac-device-and-rhythm-management-pgcert
University of Leeds,Cardiac Device and Rhythm Management,https://courses.leeds.ac.uk/i414/cardiac-device-and-rhythm-management-pgcert
University of Leeds,Cardiovascular Health and Disease,https://courses.leeds.ac.uk/j650/cardiovascular-health-and-disease
University of Leeds,Cardiovascular Health and Disease,https://courses.leeds.ac.uk/j650/cardiovascular-health-and-disease
University of Leeds,Chartered Manager (Degree) Apprenticeship BSc,https://courses.leeds.ac.uk/ap07/chartered-manager-degree-apprenticeship-bsc
University of Leeds,Chartered Manager (Degree) Apprenticeship,https://courses.leeds.ac.uk/ap07/chartered-manager-degree-apprenticeship-bsc
University of Leeds,Chemical and Energy Engineering,https://courses.leeds.ac.uk/f234/chemical-and-energy-engineering-meng-beng
University of Leeds,Chemical and Materials Engineering,https://courses.leeds.ac.uk/f237/chemical-and-materials-engineering-meng-beng
University of Leeds,Chemical and Nuclear Engineering,https://courses.leeds.ac.uk/f667/chemical-and-nuclear-engineering-meng-beng
University of Leeds,Chemical Engineering (Industrial) BEng,https://courses.leeds.ac.uk/g832/chemical-engineering-industrial-beng
