School Name,Department Name,URL,Degree,Description
Bath Spa University,Fine Art (Ceramics),https://www.bathspa.ac.uk/courses/pg-fine-art-ceramics/,Level: Postgraduate,"Our MA Ceramics pathway in Fine Art develops your skills and knowledge through a mix of material investigation, theory and research."
Bath Spa University,Fine Art (Curatorial Practice),https://www.bathspa.ac.uk/courses/pg-fine-art-curatorial-practice/,Level: Postgraduate,Study current practices and build your personal curatorial skills on our innovative Curatorial Practice Master’s.
Bath Spa University,Fine Art (Media),https://www.bathspa.ac.uk/courses/pg-fine-art-media/,Level: Postgraduate,Develop your potential as a media artist on this specialist MA course.
Bath Spa University,Fine Art (Painting),https://www.bathspa.ac.uk/courses/pg-fine-art-painting/,Level: Postgraduate,A studio based course taught by practising artists and supported by excellent facilities.
Bath Spa University,Fine Art (Photography),https://www.bathspa.ac.uk/courses/pg-fine-art-photography/,Level: Postgraduate,Study a range of approaches to photography and lens-based media in a fine art environment.
Bath Spa University,Food with Nutrition,https://www.bathspa.ac.uk/courses/ug-food-with-nutrition/,Level: Undergraduate,Equip yourself for employment with this dynamic course that fuses academic and vocational learning.
Bath Spa University,Forensic Psychology,https://www.bathspa.ac.uk/courses/ug-forensic-psychology/,Level: Undergraduate,Study a combination of accredited Psychology modules and tailored forensic topics on this Forensic Psychology degree.
Bath Spa University,Forensic Science,https://www.bathspa.ac.uk/courses/ug-forensic-science/,Level: Undergraduate,Learn how to use science to help solve crimes on this Forensic Science degree.
Bath Spa University,FWD,https://www.bathspa.ac.uk/courses/fwd/,Level: Short Course,"Take your career forward with FWD, a free, next generation skills, training, research and innovation programme."
Bath Spa University,Games Development,https://www.bathspa.ac.uk/courses/ug-games-development/,Level: Undergraduate,"Turn your love of games into a career in this hands-on, industry-focused course."
Bath Spa University,Geography,https://www.bathspa.ac.uk/courses/ug-geography/,Level: Undergraduate,Develop the knowledge and skills to understand our complex world with a degree in Geography.
Bath Spa University,Global Citizenship,https://www.bathspa.ac.uk/courses/intl-global-citizenship/,"Level: Integrated, Undergraduate","Gain an international, interdisciplinary perspective by studying Global Citizenship alongside your undergraduate course."
Bath Spa University,Global Development and Sustainability,https://www.bathspa.ac.uk/courses/ug-global-development-and-sustainability/,Level: Undergraduate,Explore contemporary global challenges and learn how to promote and implement sustainable development.
Bath Spa University,Graphic Design,https://www.bathspa.ac.uk/courses/ug-graphic-design/,Level: Undergraduate,"Interested in graphic design? This broad, practice based course encourages hands-on, ideas based, socially engaged design."
Bath Spa University,Health and Social Care Management (London),https://www.bathspa.ac.uk/courses/ug-health-social-care-management-london/,Level: Undergraduate,Our London-based Health and Social Care Management degree will give you the skills needed for efficient and effective delivery of services in the health and social care environment.
Bath Spa University,Health and Social Care Management with Integrated Foundation Year (London),https://www.bathspa.ac.uk/courses/ify-health-social-care-management-london/,"Level: Integrated, Foundation, Undergraduate",Our London based Health and Social Care Management degree with Integrated Foundation Year will develop your academic skills and prepare you for degree-level learning.
Bath Spa University,Heritage Management,https://www.bathspa.ac.uk/courses/pg-heritage-management/,Level: Postgraduate,Combine placements and projects with robust conceptual thinking through this dynamic MA course.
Bath Spa University,History,https://www.bathspa.ac.uk/courses/ug-history/,Level: Undergraduate,"Our innovative History degree has been designed to help you develop practical and professional skills that you can apply to contemporary challenges, issues and debates."
Bath Spa University,History and Philosophy and Ethics,https://www.bathspa.ac.uk/courses/ug-history-and-philosophy-and-ethics/,Level: Undergraduate,Develop practical skills as you apply your understanding of the past and your knowledge of philosophy to contemporary challenges.
Bath Spa University,History and Politics,https://www.bathspa.ac.uk/courses/ug-history-and-politics/,Level: Undergraduate,"Our innovative History with Politics degree has been designed to help you develop practical and professional skills that you can apply to contemporary challenges, issues and debates."
Bath Spa University,Human Nutrition,https://www.bathspa.ac.uk/courses/ug-human-nutrition/,Level: Undergraduate,"Explore the scientific principles behind human nutrition, food, health and disease."
Bath Spa University,Inclusive Education,https://www.bathspa.ac.uk/courses/pg-inclusive-education/,Level: Postgraduate,Become an expert in vulnerable learners and inclusion at a time of significant educational reform.
Bath Spa University,Integrated Foundation Year for Art and Design Courses,https://www.bathspa.ac.uk/courses/ify-art-and-design/,"Level: Integrated, Foundation, Undergraduate",Use our outstanding facilities and develop your Art and Design skills with an integrated Foundation year before you progress onto your chosen BA (Hons) degree.
Bath Spa University,Interior Design,https://www.bathspa.ac.uk/courses/ug-interior-design/,Level: Undergraduate,Learn to transform and repurpose spaces on our new Interior Design course.
Bath Spa University,International Commercial Law,https://www.bathspa.ac.uk/courses/pg-international-commercial-law/,Level: Postgraduate,Prepare to excel in the fast-paced world of international commerce and law with this comprehensive and forward-thinking Master's degree.
Bath Spa University,International Relations and History,https://www.bathspa.ac.uk/courses/ug-international-relations-and-history/,Level: Undergraduate,Explore the impact of local and national politics and how history informs change with our International Relations and History degree.
Bath Spa University,International Relations and Politics,https://www.bathspa.ac.uk/courses/ug-international-relations-and-politics/,Level: Undergraduate,"Explore the complexities of the contemporary world by examining the mechanisms for, or absence of, international governance with our innovative International Relations and Politics degree."
Bath Spa University,Introduction to Amharic and the Ethiopian Alphabet,https://www.bathspa.ac.uk/courses/sc-amharic-language/,Level: Short Course,"Learn about one of the diplomatic languages of Africa, how to read and write your own name in Amharic and how the Ethiopian alphabet differs from English."
Bath Spa University,Introduction to Immersive Audio,https://www.bathspa.ac.uk/courses/sc-immersive-audio/,Level: Short Course,Discover immersive audio techniques using binaural and ambisonic technologies.
Bath Spa University,Introduction to Sports Media,https://www.bathspa.ac.uk/courses/sc-sports-media/,Level: Short Course,Learn the fundamentals of covering live sports events from the grounds of Bath City Football Club.
Bath Spa University,Introduction to Writing for Young People,https://www.bathspa.ac.uk/courses/sc-introduction-to-wfyp/,Level: Short Course,"Learn about the craft of writing for children and young adults over eight weeks of creative writing exercises, class discussions and workshops."
Bath Spa University,Journalism and Publishing,https://www.bathspa.ac.uk/courses/ug-journalism-and-publishing/,Level: Undergraduate,Become a journalist for the 21st century and tell the stories that matter.
Bath Spa University,Law,https://www.bathspa.ac.uk/courses/ug-law/,Level: Undergraduate,Prepare for a career within and beyond law with our Law degree. Provide support for real situations in our legal clinic.
Bath Spa University,Law and Business,https://www.bathspa.ac.uk/courses/pg-law-and-business/,Level: Postgraduate,A contemporary and forward-thinking Master's degree aimed at developing creative professionals and entrepreneurs.
Bath Spa University,Law and Politics,https://www.bathspa.ac.uk/courses/ug-law-and-politics/,Level: Undergraduate,Develop practical and vocational skills alongside your knowledge of legal theory and specialised subject knowledge from our innovative Politics course.
Bath Spa University,Leadership,https://www.bathspa.ac.uk/courses/pg-leadership/,Level: Postgraduate,Our MBA in leadership and management offers flexible work-based learning to advance your career in senior and strategic business roles.
Bath Spa University,Legal Foundations,https://www.bathspa.ac.uk/courses/pg-legal-foundations/,Level: Postgraduate,A postgraduate law course designed to support your progress towards legal qualification in England and Wales.
Bath Spa University,Marketing,https://www.bathspa.ac.uk/courses/ug-marketing/,Level: Undergraduate,Our socially conscious Marketing degree will give you the tools to succeed in a changing digital landscape.
Bath Spa University,Marketing and Brand Management,https://www.bathspa.ac.uk/courses/pg-marketing-and-brand-management/,Level: Postgraduate,"Expand your practical, theoretical and professional experience with our Master's in Marketing and Brand Management."
Bath Spa University,MBA,https://www.bathspa.ac.uk/courses/pg-business-administration-london/,Level: Postgraduate,Become an effective and ethical manager with our MBA at Bath Spa University London.
Bath Spa University,Media Communications,https://www.bathspa.ac.uk/courses/ug-media-communications/,Level: Undergraduate,Challenge the global media landscape with this practical and research-led Media degree.
Bath Spa University,Media Communications and Publishing,https://www.bathspa.ac.uk/courses/ug-media-communications-and-publishing/,Level: Undergraduate,"Build industry contacts, gain practical skills and learn innovative approaches to communicating ideas with our Media Communications and Publishing degree."
Bath Spa University,Media Communications and Sociology,https://www.bathspa.ac.uk/courses/ug-media-communications-and-sociology/,Level: Undergraduate,"Broaden your experience, explore mass media and gain valuable, employable skills by combining a Media and Sociology degree."
Bath Spa University,Music,https://www.bathspa.ac.uk/courses/ug-music/,Level: Undergraduate,"Learn through practical music-making every day, make a difference with your music, and build a viable, sustainable career."
Bath Spa University,Music (Performance),https://www.bathspa.ac.uk/courses/ug-music-performance/,Level: Undergraduate,Become a versatile performing musician who is ready for a varied and viable career in the wider entertainment industry.
Bath Spa University,Nature and Travel Writing,https://www.bathspa.ac.uk/courses/pg-nature-and-travel-writing/,Level: Postgraduate,"For any creative writer inspired by places, people and wildlife, who wants to be published."
Bath Spa University,Performance (Acting),https://www.bathspa.ac.uk/courses/pg-performance-acting/,Level: Postgraduate,"Take your acting career to the next level with our practical, professional MA Acting course."
Bath Spa University,Performance (Creative Producing),https://www.bathspa.ac.uk/courses/pg-performance-creative-producing/,Level: Postgraduate,Do you want to produce live performances? This course is for creative producers at all stages of their career.
Bath Spa University,Performance (Directing),https://www.bathspa.ac.uk/courses/pg-performance-directing/,Level: Postgraduate,A postgraduate course for directors of theatre and live performance at all stages of their career.
Bath Spa University,Performance (Music),https://www.bathspa.ac.uk/courses/pg-performance-music/,Level: Postgraduate,Enhance your understanding of the industry and develop your performance skills on this collaborative MA Music course.
Bath Spa University,PGCE Primary and Early Years,https://www.bathspa.ac.uk/courses/pgce-primary-and-early-years/,Level: PGCE / Teaching,Become an innovative and inspiring teacher on our PGCE Primary and Early Years course.
Bath Spa University,PGCE Secondary Art and Design,https://www.bathspa.ac.uk/courses/pgce-secondary-art-and-design/,Level: PGCE / Teaching,Become an innovative and inspiring teacher on our Secondary PGCE Art and Design course.
Bath Spa University,PGCE Secondary Business Studies,https://www.bathspa.ac.uk/courses/pgce-secondary-business-studies/,Level: PGCE / Teaching,Become an innovative and inspiring teacher on our Secondary PGCE Business Studies course.
Bath Spa University,PGCE Secondary Computing,https://www.bathspa.ac.uk/courses/pgce-secondary-computing/,Level: PGCE / Teaching,Become an innovative and inspiring teacher on our Secondary PGCE Computing course.
Bath Spa University,PGCE Secondary Design and Technology,https://www.bathspa.ac.uk/courses/pgce-secondary-design-and-technology/,Level: PGCE / Teaching,Become an innovative and inspiring teacher on our Secondary PGCE Design and Technology course.
Bath Spa University,PGCE Secondary Drama,https://www.bathspa.ac.uk/courses/pgce-secondary-drama/,Level: PGCE / Teaching,Become an innovative and inspiring teacher on our Secondary PGCE Drama course.
Bath Spa University,PGCE Secondary English,https://www.bathspa.ac.uk/courses/pgce-secondary-english/,Level: PGCE / Teaching,Become an innovative and inspiring teacher on our Secondary PGCE English course.
Bath Spa University,PGCE Secondary Geography,https://www.bathspa.ac.uk/courses/pgce-secondary-geography/,Level: PGCE / Teaching,Become an innovative and inspiring teacher on our Secondary PGCE Geography course.
Bath Spa University,PGCE Secondary History,https://www.bathspa.ac.uk/courses/pgce-secondary-history/,Level: PGCE / Teaching,Become an innovative and inspiring teacher on our Secondary PGCE History course.
Bath Spa University,PGCE Secondary Mathematics,https://www.bathspa.ac.uk/courses/pgce-secondary-mathematics/,Level: PGCE / Teaching,Become an innovative and inspiring teacher on our Secondary PGCE Mathematics course.
Bath Spa University,PGCE Secondary Modern Languages,https://www.bathspa.ac.uk/courses/pgce-secondary-modern-languages/,Level: PGCE / Teaching,Become an innovative and inspiring teacher on our Secondary PGCE Modern Languages course.
Bath Spa University,PGCE Secondary Music,https://www.bathspa.ac.uk/courses/pgce-secondary-music/,Level: PGCE / Teaching,Become an innovative and inspiring teacher on our Secondary PGCE Music course.
Bath Spa University,PGCE Secondary Physical Education,https://www.bathspa.ac.uk/courses/pgce-secondary-physical-education/,Level: PGCE / Teaching,Become an innovative and inspiring teacher on our Secondary Physical Education course.
Bath Spa University,"PGCE Secondary Religion, Philosophy and Ethics",https://www.bathspa.ac.uk/courses/pgce-secondary-religion-philosophy-and-ethics/,Level: PGCE / Teaching,Become an innovative and inspiring teacher on our Secondary Religious Education course.
Bath Spa University,PGCE Secondary Science,https://www.bathspa.ac.uk/courses/pgce-secondary-science/,Level: PGCE / Teaching,Become an innovative and inspiring teacher on our Secondary Science course.
Bath Spa University,PGCert Professional Education (SENCO),https://www.bathspa.ac.uk/courses/pg-senco/,Level: Postgraduate,Postgraduate training in special educational needs coordination.
Bath Spa University,Philosophy and Ethics,https://www.bathspa.ac.uk/courses/ug-philosophy-and-ethics/,Level: Undergraduate,"Our innovative Philosophy and Ethics degree has been designed to help you develop practical and professional skills that you can apply to contemporary challenges, issues and debates."
Bath Spa University,Philosophy and Ethics and Psychology,https://www.bathspa.ac.uk/courses/ug-philosophy-and-ethics-and-psychology/,Level: Undergraduate,Gain employable skills and explore how and why we think with a combined Philosophy and Psychology degree.
Bath Spa University,Photography,https://www.bathspa.ac.uk/courses/ug-photography/,Level: Undergraduate,"Engage with photography in an experimental, creative and critical environment."
Bath Spa University,"Politics, Philosophy and Economics",https://www.bathspa.ac.uk/courses/ug-politics-philosophy-and-economics/,Level: Undergraduate,"How does the world work, and how can it be changed? This course explores issues of philosophy, politics and economics, and challenges you to devise creative solutions to local, national and global problems."
Bath Spa University,Primary and Early Years (part time),https://www.bathspa.ac.uk/courses/pgce-primary-and-early-years-pt/,Level: PGCE / Teaching,Become an innovative and inspiring teacher on our part-time PGCE Primary and Early Years course.
Bath Spa University,Primary Education (5-11) with QTS,https://www.bathspa.ac.uk/courses/ug-primary-education-with-qts/,Level: Undergraduate,"This Primary Education with QTS course will give you the knowledge, skills and confidence to shine and leads to the award of QTS."
Bath Spa University,Product Design,https://www.bathspa.ac.uk/courses/ug-product-design/,Level: Undergraduate,This contemporary design course focuses on making and innovation to address the future of production.
Bath Spa University,Professional Doctorate in Education,https://www.bathspa.ac.uk/courses/edd-professional-doctorate-in-education/,Level: Research Degree,Enhance your career in education with our Professional Doctorate.
Bath Spa University,Professional Practice,https://www.bathspa.ac.uk/courses/pg-professional-practice/,Level: Postgraduate,"Gain an in-depth understanding of your current area of professional practice with our flexible MA. Designed for busy schedules, this course is suitable for working professionals."
Bath Spa University,Professional Practice in Higher Education,https://www.bathspa.ac.uk/courses/pg-professional-practice-in-he/,Level: Postgraduate,A programme to help staff and research students address the key challenges of working in higher education.
Bath Spa University,Psychology,https://www.bathspa.ac.uk/courses/ug-psychology/,Level: Undergraduate,Understand the mind and human behaviour from a range of perspectives and methodologies.
Bath Spa University,Psychology and Sociology,https://www.bathspa.ac.uk/courses/ug-psychology-and-sociology/,Level: Undergraduate,Broaden your knowledge and examine the complexities of societies and individuals with a Psychology and Sociology degree.
Bath Spa University,Publishing,https://www.bathspa.ac.uk/courses/ug-publishing/,Level: Undergraduate,"Study Publishing as a joint subject and learn to shape stories, information and ideas for print and digital."
Bath Spa University,Scriptwriting,https://www.bathspa.ac.uk/courses/pg-scriptwriting/,Level: Postgraduate,"A collaborative, practical course designed to produce versatile, professional writers and compelling scripts."
Bath Spa University,Skills Bootcamp in Agile and Scrum Foundation (West Midlands),https://www.bathspa.ac.uk/courses/agile-and-scrum-bootcamp-west-midlands/,Level: Short Course,"Learn about the Agile mindset, common Agile practices and advanced Scrum concepts in our eight week Skills Bootcamp."
Bath Spa University,Skills Bootcamp in Agile Project Management,https://www.bathspa.ac.uk/courses/project-management-bootcamp/,Level: Short Course,During this eight week Skills Bootcamp in Agile Project Management you'll learn about the key Agile methodology frameworks and how to apply them within project management scenarios.
Bath Spa University,Skills Bootcamp in Agile Project Management and AI for your organisation,https://www.bathspa.ac.uk/courses/agile-and-ai-bootcamp/,Level: Short Course,Learn about Agile methodologies and how to implement artificial intelligence and machine learning principles in the workplace.
Bath Spa University,Skills Bootcamp in Data Analytics and Machine Learning,https://www.bathspa.ac.uk/courses/data-analytics-and-machine-learning-bootcamp/,Level: Short Course,"During this eight week Skills Bootcamp in Data Analytics and Machine Learning, you’ll learn the skills needed to start a career as a Data Analyst, Business Analyst or Data Scientist."
Bath Spa University,Skills Bootcamp in Scrum Foundation,https://www.bathspa.ac.uk/courses/scrum-foundation-bootcamp/,Level: Short Course,During this eight week Skills Bootcamp in Scrum Foundation you'll learn about Agile principles and the Scrum framework.
Bath Spa University,Skills Bootcamp in UX/UI Design,https://www.bathspa.ac.uk/courses/ux-ui-bootcamp/,Level: Short Course,In this ten week Skills Bootcamp in UX/UI Design you’ll develop the fundamental skills needed to start your journey as a User Experience (UX)/User Interface (UI) Designer.
Bath Spa University,Sociology,https://www.bathspa.ac.uk/courses/ug-sociology/,Level: Undergraduate,"A course for individuals interested in social issues, who want to help make the world a better place."
Bath Spa University,Sociology and Politics,https://www.bathspa.ac.uk/courses/ug-sociology-and-politics/,Level: Undergraduate,"Discover the power and limitations of activism, social justice, ethical politics, and sustainability on this Politics and Sociology undergraduate course."
Bath Spa University,Sound (Composition and Sonic Art),https://www.bathspa.ac.uk/courses/pg-sound-composition-and-sonic-art/,Level: Postgraduate,Realise and refine your own creative identity in sound and music with our MA in Composition and Sonic Art.
Bath Spa University,Sound (Design),https://www.bathspa.ac.uk/courses/pg-sound-design/,Level: Postgraduate,"Develop a range of sound design skills, industry-standard experience, and a high-quality portfolio that showcases everything you’ve learned on our MA Sound (Design)."
Bath Spa University,Sound (Production),https://www.bathspa.ac.uk/courses/pg-sound-production/,Level: Postgraduate,Develop your own sonic signature through this forward-thinking music and sound production course.
Bath Spa University,Specific Learning Difficulties / Dyslexia,https://www.bathspa.ac.uk/courses/pg-specific-learning-difficulties-dyslexia/,Level: Postgraduate,Gain specialist skills while you work. We’ve designed this BDA-accredited MA SpLD / Dyslexia to fit around you.
Bath Spa University,Specific Learning Difficulties / Dyslexia,https://www.bathspa.ac.uk/courses/pg-cert-specific-learning-difficulties-dyslexia/,Level: Postgraduate,Gain specialist skills while you work. We’ve designed this BDA-accredited PGCert SpLD / Dyslexia to fit around you.
Bath Spa University,Sport and Exercise Nutrition,https://www.bathspa.ac.uk/courses/ug-sport-and-exercise-nutrition/,Level: Undergraduate,"Explore the science behind diet, sports performance and health on our Sport and Exercise Nutrition degree."
Bath Spa University,Sports Management,https://www.bathspa.ac.uk/courses/ug-sports-management/,Level: Undergraduate,Learn about the sporting industry from the inside with our sports business and management degree.
Bath Spa University,Sports Media Production,https://www.bathspa.ac.uk/courses/ug-sports-media-production/,Level: Undergraduate,"Become part of the next generation of creatives on this exciting Sports Media Production course, using cutting-edge facilities, studios, equipment and resources."
Bath Spa University,Starting a Side Hustle,https://www.bathspa.ac.uk/courses/sc-starting-a-side-hustle/,Level: Short Course,"Learn how to find your target audience, market your product or service and manage your business's finances on this four day Entrepreneurship for Beginners short course."
Bath Spa University,Story Foundry PhD (Low Residency),https://www.bathspa.ac.uk/courses/phd-story-foundry/,Level: Research Degree,"Our Story Foundry PhD offers an innovative liberal arts PhD for contemporary writers, storytellers and makers whose project proposals do not fit neatly into traditional academic boxes."
Bath Spa University,Story Foundry PhD by Publication (Distance Learning),https://www.bathspa.ac.uk/courses/phd-story-foundry-publication/,Level: Research Degree,Our Story Foundry PhD by Publication is for established practitioners with a substantial body of work. This international programme encourages innovative and interdisciplinary forms of practice with a narrative or story-based focus.
Bath Spa University,Teach First Training Programme,https://www.bathspa.ac.uk/courses/pg-teach-first-training-programme/,Level: PGCE / Teaching,The Teach First Training Programme combines teacher and leadership training. The programme is based on global best practice.
Bath Spa University,Textile Design,https://www.bathspa.ac.uk/courses/ug-textile-design/,Level: Undergraduate,Interested in textiles? This dynamic and demanding course aims to create the designers and innovators of the future.
Bath Spa University,"Theatre, Festival and Event Production",https://www.bathspa.ac.uk/courses/ug-theatre-festival-and-event-production/,Level: Undergraduate,Professional theatre training delivered in partnership with the theatre production industry.
Bath Spa University,Waldorf Education and Creative Pedagogies (Low Residency),https://www.bathspa.ac.uk/courses/pg-waldorf-education-and-creative-pedagogies/,Level: Postgraduate,"Expand your career horizons and nurture your passion for creativity in education. If you have a teaching qualification, this ‘top up’ course has been designed with you in mind."
Bath Spa University,Wildlife Conservation,https://www.bathspa.ac.uk/courses/ug-wildlife-conservation/,Level: Undergraduate,"Explore conservation biology, ecology and human-wildlife interaction with a creative interdisciplinary approach, and help develop ways to protect the natural world."
